Cites,Authors,Title,Year,Source,Publisher,ArticleURL,CitesURL,GSRank,QueryDate,Type,DOI,ISSN,CitationURL,Volume,Issue,StartPage,EndPage,ECC,CitesPerYear,CitesPerAuthor,AuthorCount,Age,Abstract
10,G Ritchie,The evaluation of creative systems,2019,Computational Creativity,Springer,https://link.springer.com/chapter/10.1007/978-3-319-43610-4_8,"https://scholar.google.com/scholar?cites=11274849863443657211&as_sdt=2005&sciodt=0,5&hl=en",121,3/9/20 17:32,,,,,,,,,10,10,10,1,1,"As creative systems become more advanced, there is a growing need to assess their performance, whether during development or after implementation is complete. There is not yet any settled methodology for evaluation, despite a continuing debate. The task requires …"
11,"N Yitzhak, N Giladi, T Gurevich, DS Messinger…","Gently does it: Humans outperform a software classifier in recognizing subtle, nonstereotypical facial expressions.",2017,Emotion,psycnet.apa.org,https://psycnet.apa.org/record/2017-16349-001,"https://scholar.google.com/scholar?cites=7561040240594845321&as_sdt=2005&sciodt=0,5&hl=en",122,3/9/20 17:32,,,,,,,,,11,3.67,2,5,3,"According to dominant theories of affect, humans innately and universally express a set of emotions using specific configurations of prototypical facial activity. Accordingly, thousands of studies have tested emotion recognition using sets of highly intense and stereotypical …"
10,"IM Greven, R Ramsey",Neural network integration during the perception of in-group and out-group members,2017,Neuropsychologia,Elsevier,https://www.sciencedirect.com/science/article/pii/S0028393217303688,"https://scholar.google.com/scholar?cites=12385390821958376462&as_sdt=2005&sciodt=0,5&hl=en",123,3/9/20 17:32,HTML,,,,,,,,10,3.33,5,2,3,"Group biases guide social interactions by promoting in-group favouritism, but the neural mechanisms underpinning group biases remain unclear. While neuroscience research has shown that distributed brain circuits are associated with seeing in-group and out-group …"
10,"LD Lopez, PJ Reschke, JM Knothe…",Postural communication of emotion: Perception of distinct poses of five discrete emotions,2017,Frontiers in …,frontiersin.org,https://www.frontiersin.org/articles/10.3389/fpsyg.2017.00710,"https://scholar.google.com/scholar?cites=2613446479538243478&as_sdt=2005&sciodt=0,5&hl=en",124,3/9/20 17:32,HTML,,,,,,,,10,3.33,3,4,3,"Emotion can be communicated through multiple distinct modalities. However, an often-ignored channel of communication is posture. Recent research indicates that bodily posture plays an important role in the perception of emotion. However, research examining postural …"
9,"RM Stolier, JB Freeman",The neuroscience of social vision,2016,"Neuroimaging personality, social cognition, and …",Elsevier,https://www.sciencedirect.com/science/article/pii/B9780128009352000075,"https://scholar.google.com/scholar?cites=4596795269341840477&as_sdt=2005&sciodt=0,5&hl=en",125,3/9/20 17:32,,,,,,,,,9,2.25,5,2,4,"Through mere visual cues, humans readily extract a variety of information about other people. In addition to bottom-up visual cues, our social perceptions are dynamically shaped by a number of top-down social factors, including stereotypes, person knowledge, motives …"
11,"N Lavan, CF Lima, H Harvey, SK Scott…",I thought that I heard you laughing: Contextual facial expressions modulate the perception of authentic laughter and crying,2015,Cognition and …,Taylor & Francis,https://www.tandfonline.com/doi/abs/10.1080/02699931.2014.957656,"https://scholar.google.com/scholar?cites=5633353981135335973&as_sdt=2005&sciodt=0,5&hl=en",126,3/9/20 17:32,,,,,,,,,11,2.2,2,5,5,It is well established that categorising the emotional content of facial expressions may differ depending on contextual information. Whether this malleability is observed in the auditory domain and in genuine emotion expressions is poorly explored. We examined the …
10,"R Hortensius, B De Gelder, DJLG Schutter",When anger dominates the mind: Increased motor corticospinal excitability in the face of threat,2016,Psychophysiology,Wiley Online Library,https://onlinelibrary.wiley.com/doi/abs/10.1111/psyp.12685,"https://scholar.google.com/scholar?cites=17037634270127510141&as_sdt=2005&sciodt=0,5&hl=en",127,3/9/20 17:32,,,,,,,,,10,2.5,3,3,4,"Threat demands fast and adaptive reactions that are manifested at the physiological, behavioral, and phenomenological level and are responsive to the direction of threat and its severity for the individual. Here, we investigated the effects of threat directed toward or away …"
9,"MQ Hill, S Streuber, CA Hahn, MJ Black…",Creating body shapes from verbal descriptions by linking similarity spaces,2016,Psychological …,journals.sagepub.com,https://journals.sagepub.com/doi/abs/10.1177/0956797616663878,"https://scholar.google.com/scholar?cites=9878985667873371010&as_sdt=2005&sciodt=0,5&hl=en",128,3/9/20 17:32,,,,,,,,,9,2.25,2,5,4,"Brief verbal descriptions of people's bodies (eg,“curvy,”“long-legged”) can elicit vivid mental images. The ease with which these mental images are created belies the complexity of three-dimensional body shapes. We explored the relationship between body shapes and body …"
10,"D Marinova, SK Singh, J Singh",Frontline problem-solving effectiveness: A dynamic analysis of verbal and nonverbal cues,2018,Journal of Marketing …,journals.sagepub.com,https://journals.sagepub.com/doi/abs/10.1509/jmr.15.0243,"https://scholar.google.com/scholar?cites=6237870925894149159&as_sdt=2005&sciodt=0,5&hl=en",129,3/9/20 17:32,,,,,,,,,10,5,3,3,2,"This study examines the impact of frontline employees' problem solving on customer satisfaction (CSAT) during ongoing interactions prompted by service failures and complaints. Using outsourced regulation theory, the authors predict negative moderating …"
9,CF Keating,The developmental arc of nonverbal communication: Capacity and consequence for human social bonds.,2016,,psycnet.apa.org,https://psycnet.apa.org/record/2015-02851-005,"https://scholar.google.com/scholar?cites=10797077430494104160&as_sdt=2005&sciodt=0,5&hl=en",130,3/9/20 17:32,,,,,,,,,9,2.25,9,1,4,"Like other human competencies, the skillful exchange of nonverbal signals arcs across the life span, revealing a developmental time course for the capacity to send (encode) and receive (decode) messages. The aim of this chapter is to describe ontogenetic patterns in …"
8,"J Sanchez-Burks, CA Bartel, L Rees…",Assessing collective affect recognition via the Emotional Aperture Measure,2016,Cognition and Emotion,Taylor & Francis,https://www.tandfonline.com/doi/abs/10.1080/02699931.2015.1015968,"https://scholar.google.com/scholar?cites=10231117642815435180&as_sdt=2005&sciodt=0,5&hl=en",131,3/9/20 17:32,,,,,,,,,8,2,2,4,4,"Curiosity about collective affect is undergoing a revival in many fields. This literature, tracing back to Le Bon's seminal work on crowd psychology, has established the veracity of collective affect and demonstrated its influence on a wide range of group dynamics. More …"
8,R López-Ozieblo,Refections on the use of nonverbal communication in teaching Spanish to sino-speakers,2013,LFE. Revista de Lenguas para Fines …,accedacris.ulpgc.es,https://accedacris.ulpgc.es/bitstream/10553/12243/1/0233536_00019_0014.pdf,"https://scholar.google.com/scholar?cites=4751556766364775331&as_sdt=2005&sciodt=0,5&hl=en",132,3/9/20 17:32,PDF,,,,,,,,8,1.14,8,1,7,"The increased interest in Spanish as a Foreign Language (FL) has meant that in China alone there are 25,000 university students taking Spanish courses (Instituto Cervantes, 2013). The demand for Spanish language and culture courses has yet to be met by …"
9,"CY Yi, MWE Murry, AL Gentzler",Perception of emotional expressions in adults,2016,Journal of Individual …,econtent.hogrefe.com,https://econtent.hogrefe.com/doi/full/10.1027/1614-0001/a000183,"https://scholar.google.com/scholar?cites=3684853083881713234&as_sdt=2005&sciodt=0,5&hl=en",133,3/9/20 17:32,,,,,,,,,9,2.25,3,3,4,"Past research suggests that transient mood influences the perception of facial expressions of emotion, but relatively little is known about how trait-level emotionality (ie, temperament) may influence emotion perception or interact with mood in this process. Consequently, we …"
8,"KS Wehebrink, K Koelkebeck, S Piest…",Pupil mimicry and trust–Implication for depression,2018,Journal of psychiatric …,Elsevier,https://www.sciencedirect.com/science/article/pii/S0022395617308191,"https://scholar.google.com/scholar?cites=6947002748093979557&as_sdt=2005&sciodt=0,5&hl=en",134,3/9/20 17:32,,,,,,,,,8,4,2,4,2,Individuals suffering from depression often have difficulty trusting others. Previous research has shown a relationship between trust formation and pupil mimicry-the synchronization of pupil sizes between individuals. The current study therefore examined whether pupil …
9,OR Aragón,“Tears of joy” and “tears and joy?” personal accounts of dimorphous and mixed expressions of emotion,2017,Motivation and Emotion,Springer,https://link.springer.com/article/10.1007/s11031-017-9606-x,"https://scholar.google.com/scholar?cites=7692410274187182834&as_sdt=2005&sciodt=0,5&hl=en",135,3/9/20 17:32,,,,,,,,,9,3,9,1,3,"In this investigation two distinct theoretical frameworks were applied to personal accounts of experiencing both smiles and crying, informally referred to as “tears of joy.” Dimorphous theory posits that such expressions arise from a positive or negative appraisal, and a single …"
8,J Sak-Wernicka,The effect of nonverbal cues on the interpretation of utterances by people with visual impairments,2014,Journal of Visual Impairment & Blindness,journals.sagepub.com,https://journals.sagepub.com/doi/abs/10.1177/0145482X1410800205,"https://scholar.google.com/scholar?cites=14022410247155076918&as_sdt=2005&sciodt=0,5&hl=en",136,3/9/20 17:32,,,,,,,,,8,1.33,8,1,6,Introduction The purpose of this article is to explore the effect of nonverbal information (gestures and facial expressions) provided in real time on the interpretation of utterances by people with total blindness. Methods The article reports on an exploratory study performed …
11,"H Toscano, TW Schubert, SR Giessner","Eye gaze and head posture jointly influence judgments of dominance, physical strength, and anger",2018,Journal of Nonverbal Behavior,Springer,https://link.springer.com/article/10.1007/s10919-018-0276-5,"https://scholar.google.com/scholar?cites=13668524295283927621&as_sdt=2005&sciodt=0,5&hl=en",137,3/9/20 17:32,,,,,,,,,11,5.5,4,3,2,Social status hierarchies are a universal principle of organization in human societies. Status judgments are often influenced by perceptions of the face and posture. Two important nonverbal cues of social status are head postures and eye gaze. Prior research has shown …
9,SA Butterfill,Perceiving expressions of emotion: What evidence could bear on questions about perceptual experience of mental states?,2015,Consciousness and cognition,Elsevier,https://www.sciencedirect.com/science/article/pii/S1053810015000574,"https://scholar.google.com/scholar?cites=1852569961747167690&as_sdt=2005&sciodt=0,5&hl=en",138,3/9/20 17:32,,,,,,,,,9,1.8,9,1,5,"What evidence could bear on questions about whether humans ever perceptually experience any of another's mental states, and how might those questions be made precise enough to test experimentally? This paper focusses on emotions and their expression. It is …"
8,"C Chen, C Crivelli, OGB Garrod…",Distinct facial expressions represent pain and pleasure across cultures,2018,Proceedings of the …,National Acad Sciences,https://www.pnas.org/content/115/43/E10013.short,"https://scholar.google.com/scholar?cites=29694319935853110&as_sdt=2005&sciodt=0,5&hl=en",139,3/9/20 17:32,,,,,,,,,8,4,2,4,2,"Real-world studies show that the facial expressions produced during pain and orgasm—two different and intense affective experiences—are virtually indistinguishable. However, this finding is counterintuitive, because facial expressions are widely considered to be a …"
8,"J Walsh, C Eccleston, E Keogh",Sex differences in the decoding of pain‐related body postures,2017,European Journal of Pain,Wiley Online Library,https://onlinelibrary.wiley.com/doi/abs/10.1002/ejp.1072,"https://scholar.google.com/scholar?cites=7448524672471435342&as_sdt=2005&sciodt=0,5&hl=en",140,3/9/20 17:32,,,,,,,,,8,2.67,3,3,3,"Background Pain can be detected through nonverbal cues, including facial expressions, vocalisations, and body posture. While there are sex differences in how emotional expressions are recognized, these differences have not always been found for pain. One …"
8,"CSS Tan, J Schöning, JS Barnes, K Luyten…",Bro-cam: Improving game experience with empathic feedback using posture tracking,2013,International Conference …,Springer,https://link.springer.com/chapter/10.1007/978-3-642-37157-8_27,"https://scholar.google.com/scholar?cites=108525774226693444&as_sdt=2005&sciodt=0,5&hl=en",141,3/9/20 17:32,,,,,,,,,8,1.14,2,5,7,In todays videogames user feedback is often provided through raw statistics and scoreboards. We envision that incorporating empathic feedback matching the player's current mood will improve the overall gaming experience. In this paper we present Bro-cam …
8,"A Baker, S Porter, L ten Brinke…",Risky business: Incorporating informed deception detection strategies in violence risk assessments,2015,Archives of Forensic …,pdfs.semanticscholar.org,https://pdfs.semanticscholar.org/0b31/a88c4df0de648f6688c67262a748ee6eaa98.pdf,"https://scholar.google.com/scholar?cites=16842972103690229671&as_sdt=2005&sciodt=0,5&hl=en",142,3/9/20 17:32,PDF,,,,,,,,8,1.6,2,4,5,"Although the relevance of deception detection is well established in police investigations and the courtroom, it has been less salient in the context of psychological risk assessments at various levels of the legal system such as sentencing, preventative detention hearings …"
8,"D Dukes, F Clément, C Audrin, M Mortillaro",Looking beyond the static face in emotion recognition: the informative case of interest,2017,Visual Cognition,Taylor & Francis,https://www.tandfonline.com/doi/abs/10.1080/13506285.2017.1341441,"https://scholar.google.com/scholar?cites=10285600071391263502&as_sdt=2005&sciodt=0,5&hl=en",143,3/9/20 17:32,,,,,,,,,8,2.67,2,4,3,"ABSTRACT A new wave of studies on emotion recognition encourages researchers to look beyond the face as the sole source of pertinent information. One study has proposed that, while there is overwhelming evidence that negative emotions may be differentiated in static …"
22,ML Felis,Modeling emotional aspects in human locomotion,2015,,ub.uni-heidelberg.de,https://www.ub.uni-heidelberg.de/archiv/19319,"https://scholar.google.com/scholar?cites=11923484693044432279&as_sdt=2005&sciodt=0,5&hl=en",144,3/9/20 17:32,HTML,,,,,,,,22,4.4,22,1,5,"The study of emotional body language has been the effort of many scientists for more than 200 years, from areas such as psychology, neuroscience, biology, and others. A lot of work has focused on the analysis of the kinematics, while the study of the underlying dynamics is …"
7,M Lewis,Emotional development and consciousness,2015,Handbook of child psychology and developmental …,Wiley Online Library,https://onlinelibrary.wiley.com/doi/abs/10.1002/9781118963418.childpsy111,"https://scholar.google.com/scholar?cites=12733559897855723226&as_sdt=2005&sciodt=0,5&hl=en",145,3/9/20 17:32,,,,,,,,,7,1.4,7,1,5,"This chapter presents the idea that consciousness, conceived as self‐reflection, and its development is the central feature of human emotional development. While human self‐reflection is a materialistic feature of our brains, its mentalistic feature is part of a large …"
7,"TF Price, E Harmon-Jones",Embodying approach motivation: a review of recent evidence,2016,Advances in Motivation Science,Elsevier,https://www.sciencedirect.com/science/article/pii/S221509191530002X,"https://scholar.google.com/scholar?cites=12129711372002948105&as_sdt=2005&sciodt=0,5&hl=en",146,3/9/20 17:32,,,,,,,,,7,1.75,4,2,4,"Recent evidence suggests that certain postures and facial expressions are associated with motivational and emotional responses. This review considers behavioral, neuroscientific, and cognitive research associating movements of the body with emotive responses. Facial …"
7,"S Griffiths, G Rhodes, L Jeffery, R Palermo…",The average facial expression of a crowd influences impressions of individual expressions.,2018,Journal of …,psycnet.apa.org,https://psycnet.apa.org/doiLanding?doi=10.1037/xhp0000446,"https://scholar.google.com/scholar?cites=18054744492293208697&as_sdt=2005&sciodt=0,5&hl=en",147,3/9/20 17:32,,,,,,,,,7,3.5,1,5,2,"People can accurately assess the “mood of a crowd” by rapidly extracting the average intensity of all the individual expressions, when the crowd consists of a set of faces comprising different expressions of the same individual. Here, we investigate the processes …"
7,"R Xiao, X Li, L Li, Y Wang",Can we distinguish emotions from faces? Investigation of implicit and explicit processes of peak facial expressions,2016,Frontiers in psychology,frontiersin.org,https://www.frontiersin.org/articles/10.3389/fpsyg.2016.01330,"https://scholar.google.com/scholar?cites=13545542647365013240&as_sdt=2005&sciodt=0,5&hl=en",148,3/9/20 17:32,HTML,,,,,,,,7,1.75,2,4,4,"Most previous studies on facial expression recognition have focused on the moderate emotions; to date, few studies have been conducted to investigate the explicit and implicit processes of peak emotions. In the current study, we used transiently peak intense …"
7,"DN Albohn, RB Adams Jr",Social vision: At the intersection of vision and person perception,2016,"Neuroimaging personality, social cognition, and …",Elsevier,https://www.sciencedirect.com/science/article/pii/B9780128009352000087,"https://scholar.google.com/scholar?cites=4354379438691113757&as_sdt=2005&sciodt=0,5&hl=en",149,3/9/20 17:32,,,,,,,,,7,1.75,4,2,4,"In this chapter, we examine how the ecological model of vision can be applied to person perception, with a specific emphasis on the combinatorial nature of face perception. Key behavior and neuroanatomical research from the face perception literature is examined …"
7,ACA Freitas-magalhães,Handbook on Facial Expression of Emotion,2016,,books.google.com,https://books.google.com/books?hl=en&lr=&id=qo17CwAAQBAJ&oi=fnd&pg=PT11&ots=5Tdv79iPJm&sig=WKJoo7cBjMIm31dmLO6ne8cBwnE,"https://scholar.google.com/scholar?cites=17349657373418174818&as_sdt=2005&sciodt=0,5&hl=en",150,3/9/20 17:32,BOOK,,,,,,,,7,1.75,7,1,4,This volume provides a comprehensive road map of the important and rapidly growing field of facial expression of emotion. Each chapter represents a unique perspective on facial emotional expression. Various innovative and classical theoretical approaches are …
7,"M Mahmoud, T Baltrušaitis, P Robinson",Automatic analysis of naturalistic hand-over-face gestures,2016,ACM Transactions on …,dl.acm.org,https://dl.acm.org/doi/abs/10.1145/2946796,"https://scholar.google.com/scholar?cites=15751280411075959306&as_sdt=2005&sciodt=0,5&hl=en",151,3/9/20 17:32,,,,,,,,,7,1.75,2,3,4,"One of the main factors that limit the accuracy of facial analysis systems is hand occlusion. As the face becomes occluded, facial features are lost, corrupted, or erroneously detected. Hand-over-face occlusions are considered not only very common but also very challenging …"
7,"R Hortensius, F Hekele…",The perception of emotion in artificial agents,2018,IEEE Transactions on …,ieeexplore.ieee.org,https://ieeexplore.ieee.org/abstract/document/8341761/,"https://scholar.google.com/scholar?cites=7072035741213952041&as_sdt=2005&sciodt=0,5&hl=en",152,3/9/20 17:32,,,,,,,,,7,3.5,2,3,2,"Given recent technological developments in robotics, artificial intelligence, and virtual reality, it is perhaps unsurprising that the arrival of emotionally expressive and reactive artificial agents is imminent. However, if such agents are to become integrated into our social milieu …"
8,"DJ Lick, CM Carpinella, MA Preciado…",Reverse-correlating mental representations of sex-typed bodies: the effect of number of trials on image quality,2013,Frontiers in …,frontiersin.org,https://www.frontiersin.org/articles/10.3389/fpsyg.2013.00476,"https://scholar.google.com/scholar?cites=187542700089575839&as_sdt=2005&sciodt=0,5&hl=en",153,3/9/20 17:32,HTML,,,,,,,,8,1.14,2,4,7,"Sex categorization is a critical process in social perception. While psychologists have long theorized that perceivers have distinct mental representations of men and women that help them to achieve efficient sex categorizations, researchers have only recently begun using …"
7,"Q Xu, Y Yang, E Zhang, F Qiao, W Lin, N Liang",Emotional conflict in facial expression processing during scene viewing: an ERP study,2015,Brain research,Elsevier,https://www.sciencedirect.com/science/article/pii/S0006899315001675,"https://scholar.google.com/scholar?cites=12627687187137628421&as_sdt=2005&sciodt=0,5&hl=en",154,3/9/20 17:32,,,,,,,,,7,1.4,1,6,5,Facial expressions are fundamental emotional stimuli as they convey important information in social interaction. In everyday life a face always appears in complex context. Scenes which faces are embedded in provided typical visual context. The aim of the present study …
8,"K Osypiuk, E Thompson, PM Wayne",Can Tai Chi and qigong postures shape our mood? Toward an embodied cognition framework for mind-body research,2018,Frontiers in human …,frontiersin.org,https://www.frontiersin.org/articles/10.3389/fnhum.2018.00174,"https://scholar.google.com/scholar?cites=6199012046456525813&as_sdt=2005&sciodt=0,5&hl=en",155,3/9/20 17:32,HTML,,,,,,,,8,4,3,3,2,"Dynamic and static body postures are a defining characteristic of mind-body practices such as Tai Chi and Qigong. A growing body of evidence supports the hypothesis that Tai Chi and Qigong may be beneficial for psychological health, including management and prevention of …"
7,"A Mileti, MI Prete, G Guido",Brand emotional credibility: Effects of mixed emotions about branded products with varying credibility,2013,Psychological reports,journals.sagepub.com,https://journals.sagepub.com/doi/abs/10.2466/31.07.PR0.113x22z7,"https://scholar.google.com/scholar?cites=13650231185485749685&as_sdt=2005&sciodt=0,5&hl=en",156,3/9/20 17:32,,,,,,,,,7,1,2,3,7,"This research investigates the effects of mixed emotions on the positioning and on the intention to purchase different categories of branded products (ie, Attractiveness-products, Expertise-products, and Trustworthiness-products), in relation to their main component of …"
17,W Wildgen,Visuelle Semiotik: Die Entfaltung des Sichtbaren. Vom Höhlenbild bis zur modernen Stadt,2014,,books.google.com,https://books.google.com/books?hl=en&lr=&id=GKWiBQAAQBAJ&oi=fnd&pg=PP1&ots=4utazbV8h7&sig=1a6echQU9Hjr2VIOqUy7s78Nzkg,"https://scholar.google.com/scholar?cites=6607648316328951527&as_sdt=2005&sciodt=0,5&hl=en",157,3/9/20 17:32,BOOK,,,,,,,,17,2.83,17,1,6,Das Sichtbare umfasst die Natur und die vom Menschen geformten Gebrauchs-und Kunstobjekte. Visuelle Zeichen konzentrieren das Prägnante und kulturell Tradierte in dieser Welt. In der global konzipierten Analyse werden visuelle Zeichen von den …
6,"K Petri, N Bandow, S Salb, K Witte",The influence of facial expressions on attack recognition and response behaviour in karate kumite,2019,European journal of sport …,Taylor & Francis,https://www.tandfonline.com/doi/abs/10.1080/17461391.2018.1536170,"https://scholar.google.com/scholar?cites=2811295080513501154&as_sdt=2005&sciodt=0,5&hl=en",158,3/9/20 17:32,,,,,,,,,6,6,2,4,1,"Facial expressions play a crucial role in human daily life interactions, so it is possible that they contain relevant anticipatory cues. Therefore, we conducted two studies in karate kumite to analyse the influence of facial expressions on the attack recognition (study A) and …"
6,"I Behoora, CS Tucker",Quantifying emotional states based on body language data using non invasive sensors,2014,ASME 2014 International …,asmedigitalcollection.asme.org,https://asmedigitalcollection.asme.org/IDETC-CIE/proceedings-abstract/IDETC-CIE2014/46285/V01AT02A079/256650,"https://scholar.google.com/scholar?cites=14915850747155583662&as_sdt=2005&sciodt=0,5&hl=en",159,3/9/20 17:32,,,,,,,,,6,1,3,2,6,"Determining participant engagement is an important issue across a large number of fields, ranging from entertainment to education. Traditionally, feedback from participants is taken after the activity has been completed. Alternately, continuous observation by trained humans …"
6,"NL Nelson, JA Russell",Children distinguish between positive pride and hubris.,2015,Developmental psychology,psycnet.apa.org,https://psycnet.apa.org/journals/dev/51/11/1609.html?uid=2015-40306-001,"https://scholar.google.com/scholar?cites=5089751914373995072&as_sdt=2005&sciodt=0,5&hl=en",160,3/9/20 17:32,,,,,,,,,6,1.2,3,2,5,"Adults distinguish expressions of hubris from those of positive pride. To determine whether children (N= 183; 78–198 months old) make a similar distinction, we asked them to attribute emotion labels and a variety of social characteristics to dynamic expressions intended to …"
6,"Z Chen, D Whitney",Tracking the affective state of unseen persons,2019,… of the National Academy of Sciences,National Acad Sciences,https://www.pnas.org/content/116/15/7559.short,"https://scholar.google.com/scholar?cites=14652936734324433011&as_sdt=2005&sciodt=0,5&hl=en",161,3/9/20 17:32,,,,,,,,,6,6,3,2,1,"Emotion recognition is an essential human ability critical for social functioning. It is widely assumed that identifying facial expression is the key to this, and models of emotion recognition have mainly focused on facial and bodily features in static, unnatural conditions …"
