"Cites,Authors,Title,Year,Source,Publisher,ArticleURL,CitesURL,GSRank,QueryDate,Type,DOI,ISSN,CitationURL,Volume,Issue,StartPage,EndPage,ECC,CitesPerYear,CitesPerAuthor,AuthorCount,Age,Abstract"
"2195,""JH Stronge"",""Qualities of effective teachers"",2018,"""",""books.google.com"",""https://books.google.com/books?hl=en&lr=&id=-bRUDwAAQBAJ&oi=fnd&pg=PP1&ots=y-_cSDNGjU&sig=X06uPGlozJlIGljBjH_dol6i3Fs"",""https://scholar.google.com/scholar?cites=10910523460875286515&as_sdt=2005&sciodt=0,5&hl=en"",1,""2020-03-10 08:38:30"",""BOOK"","""","""","""",,,,,2195,1097.50,2195,1,2,""Every teacher seeks to be an effective teacher. Every teacher wants to have a positive, remarkable, and lasting influence on students' lives. But what makes for an effective teacher? What role does teacher preparation play in teacher effectiveness? What do …"""
"1799,""J Dunlosky, KA Rawson, EJ Marsh…"",""Improving students' learning with effective learning techniques: Promising directions from cognitive and educational psychology"",2013,""… Science in the …"",""journals.sagepub.com"",""https://journals.sagepub.com/doi/abs/10.1177/1529100612453266"",""https://scholar.google.com/scholar?cites=15049619477459764789&as_sdt=2005&sciodt=0,5&hl=en"",2,""2020-03-10 08:38:30"","""","""","""","""",,,,,1799,257.00,450,4,7,""Many students are being left behind by an educational system that some people believe is in crisis. Improving educational outcomes will require efforts on many fronts, but a central premise of this monograph is that one part of a solution involves helping students to better …"""
"410,""CA Rowland"",""The effect of testing versus restudy on retention: a meta-analytic review of the testing effect."",2014,""Psychological Bulletin"",""psycnet.apa.org"",""https://psycnet.apa.org/doiLanding?doi=10.1037%2Fa0037559"",""https://scholar.google.com/scholar?cites=6202881867997343646&as_sdt=2005&sciodt=0,5&hl=en"",3,""2020-03-10 08:38:30"","""","""","""","""",,,,,410,68.33,410,1,6,""Engaging in a test over previously studied information can serve as a potent learning event, a phenomenon referred to as the testing effect. Despite a surge of research in the past decade, existing theories have not yet provided a cohesive account of testing phenomena …"""
"348,""CF Camerer, A Dreber, F Holzmeister, TH Ho…"",""Evaluating the replicability of social science experiments in Nature and Science between 2010 and 2015"",2018,""Nature Human …"",""nature.com"",""https://www.nature.com/articles/S41562-018-0399-Z"",""https://scholar.google.com/scholar?cites=14458592275451163300&as_sdt=2005&sciodt=0,5&hl=en"",4,""2020-03-10 08:38:30"","""","""","""","""",,,,,348,174.00,70,5,2,""Being able to replicate scientific findings is crucial for scientific progress 1, 2, 3, 4, 5, 6, 7, 8, 9, 10, 11, 12, 13, 14, 15. We replicate 21 systematically selected experimental studies in the social sciences published in Nature and Science between 2010 and 2015 16, 17, 18, 19, 20 …"""
"319,""DG Glance, M Forsey, M Riley"",""The pedagogical foundations of massive open online courses"",2013,""First monday"",""firstmonday.org"",""http://firstmonday.org/ojs/index.php/fm/article/view/4350"",""https://scholar.google.com/scholar?cites=13421918207205378934&as_sdt=2005&sciodt=0,5&hl=en"",5,""2020-03-10 08:38:30"","""","""","""","""",,,,,319,45.57,106,3,7,""In 2011, the respective roles of higher education institutions and students worldwide were brought into question by the rise of the massive open online course (MOOC). MOOCs are defined by signature characteristics that include: lectures formatted as short videos …"""
"313,""HL Roediger III, AL Putnam, MA Smith"",""Ten benefits of testing and their applications to educational practice"",2011,""Psychology of learning and …"",""Elsevier"",""https://www.sciencedirect.com/science/article/pii/B9780123876911000016"",""https://scholar.google.com/scholar?cites=13727705944815068218&as_sdt=2005&sciodt=0,5&hl=en"",6,""2020-03-10 08:38:30"","""","""","""","""",,,,,313,34.78,104,3,9,""Testing in school is usually done for purposes of assessment, to assign students grades (from tests in classrooms) or rank them in terms of abilities (in standardized tests). Yet tests can serve other purposes in educational settings that greatly improve performance; this …"""
"272,""JD Karpicke"",""Retrieval-based learning: Active retrieval promotes meaningful learning"",2012,""Current Directions in Psychological Science"",""journals.sagepub.com"",""https://journals.sagepub.com/doi/abs/10.1177/0963721412443552"",""https://scholar.google.com/scholar?cites=15229518444910704939&as_sdt=2005&sciodt=0,5&hl=en"",7,""2020-03-10 08:38:30"","""","""","""","""",,,,,272,34.00,272,1,8,""Retrieval is the key process for understanding learning and for promoting learning, yet retrieval is not often granted the central role it deserves. Learning is typically identified with the encoding or construction of knowledge, and retrieval is considered merely the …"""
"211,""DG Brauer, KJ Ferguson"",""The integrated curriculum in medical education: AMEE Guide No. 96"",2015,""Medical teacher"",""Taylor & Francis"",""https://www.tandfonline.com/doi/abs/10.3109/0142159X.2014.970998"",""https://scholar.google.com/scholar?cites=15693014506683535248&as_sdt=2005&sciodt=0,5&hl=en"",8,""2020-03-10 08:38:30"","""","""","""","""",,,,,211,42.20,106,2,5,""The popularity of the term “integrated curriculum” has grown immensely in medical education over the last two decades, but what does this term mean and how do we go about its design, implementation, and evaluation? Definitions and application of the term vary …"""
"203,""M Warschauer"",""Learning in the Cloud"",2011,"""",""books.google.com"",""https://books.google.com/books?hl=en&lr=&id=DB5hAgAAQBAJ&oi=fnd&pg=PR5&ots=BFMXwW1wOT&sig=krUJPxDxuYjZ4ObRed1r0UF41aE"",""https://scholar.google.com/scholar?cites=13646844408495132895&as_sdt=2005&sciodt=0,5&hl=en"",9,""2020-03-10 08:38:30"",""BOOK"","""","""","""",,,,,203,22.56,203,1,9,""This comprehensive and cutting-edge book portrays a vision of how digital media can help transform schools, and what kinds of curriculum pedagogy, assessment, infrastructure, and learning environments are necessary for the transformation to take place. The author and his …"""
"200,""SK Carpenter"",""Testing enhances the transfer of learning"",2012,""Current directions in psychological science"",""journals.sagepub.com"",""https://journals.sagepub.com/doi/abs/10.1177/0963721412452728"",""https://scholar.google.com/scholar?cites=10954418312397543913&as_sdt=2005&sciodt=0,5&hl=en"",10,""2020-03-10 08:38:30"","""","""","""","""",,,,,200,25.00,200,1,8,""Many studies have shown that retrieving information during a test facilitates later memory for that information. Most research on this testing effect has focused on retention of information measured via a final test that is similar to the initial test. Much less is known about the …"""
"196,""JD Karpicke, M Lehman, WR Aue"",""Retrieval-based learning: An episodic context account"",2014,""Psychology of learning and motivation"",""Elsevier"",""https://www.sciencedirect.com/science/article/pii/B9780128002834000071"",""https://scholar.google.com/scholar?cites=2207100862094174605&as_sdt=2005&sciodt=0,5&hl=en"",11,""2020-03-10 08:38:30"","""","""","""","""",,,,,196,32.67,65,3,6,""Practicing retrieval is a powerful way to promote learning and long-term retention. This chapter addresses the theoretical underpinnings of retrieval-based learning. We review methodological issues in retrieval practice research, identify key findings to be accounted …"""
"184,""JD Karpicke, PJ Grimaldi"",""Retrieval-based learning: A perspective for enhancing meaningful learning"",2012,""Educational Psychology Review"",""Springer"",""https://link.springer.com/article/10.1007/s10648-012-9202-2"",""https://scholar.google.com/scholar?cites=12402582020089796783&as_sdt=2005&sciodt=0,5&hl=en"",12,""2020-03-10 08:38:30"","""","""","""","""",,,,,184,23.00,92,2,8,""Learning is often identified with the acquisition, encoding, or construction of new knowledge, while retrieval is often considered only a means of assessing knowledge, not a process that contributes to learning. Here, we make the case that retrieval is the key process for …"""
"186,""RM Felder, R Brent"",""Teaching and learning STEM: A practical guide"",2016,"""",""books.google.com"",""https://books.google.com/books?hl=en&lr=&id=1Qh0CgAAQBAJ&oi=fnd&pg=PR3&ots=G-3hQAjATb&sig=Y8jqyUQSdheoZRn4giBgn46ikrI"",""https://scholar.google.com/scholar?cites=4438713765183945192&as_sdt=2005&sciodt=0,5&hl=en"",13,""2020-03-10 08:38:30"",""BOOK"","""","""","""",,,,,186,46.50,93,2,4,""Rethink traditional teaching methods to improve student learning and retention in STEM Educational research has repeatedly shown that compared to traditional teacher-centered instruction, certain learner-centered methods lead to improved learning outcomes, greater …"""
"175,""AJ Trevor, BG Katzung, SB Masters, M Kruidering-Hall"",""Pharmacology examination & board review"",2010,"""",""academia.edu"",""https://www.academia.edu/download/57722338/Katzung_and_Trevor_PCOL_Reviewer.pdf_1.pdf"",""https://scholar.google.com/scholar?cites=13255691643242133520&as_sdt=2005&sciodt=0,5&hl=en"",14,""2020-03-10 08:38:30"",""BOOK"","""","""","""",,,,,175,17.50,44,4,10,""Preface faculty colleagues, and to our students, who have taught us most of what we know about teaching. We very much appreciate the invaluable contributions to this text afforded by the editorial team of Karen Edmonson, Rachel D'Annucci Henriquez, Shruti Awasthi, Harriet …"""
"155,""I Nawrot, A Doucet"",""Building engagement for MOOC students: introducing support for time management on online learning platforms"",2014,""Proceedings of the 23rd International Conference on …"",""dl.acm.org"",""https://dl.acm.org/doi/abs/10.1145/2567948.2580054"",""https://scholar.google.com/scholar?cites=5831236561456488602&as_sdt=2005&sciodt=0,5&hl=en"",15,""2020-03-10 08:38:30"","""","""","""","""",,,,,155,25.83,78,2,6,""The main objectives of massive open online courses (MOOC) are to foster knowledge through free high quality learning materials procurement; to create new knowledge through diverse users' interactions with the providing platform; and to empower research on learning …"""
"155,""PJ Grimaldi, JD Karpicke"",""When and why do retrieval attempts enhance subsequent encoding?"",2012,""Memory & cognition"",""Springer"",""https://link.springer.com/article/10.3758/s13421-011-0174-0"",""https://scholar.google.com/scholar?cites=907096063297469798&as_sdt=2005&sciodt=0,5&hl=en"",16,""2020-03-10 08:38:30"",""HTML"","""","""","""",,,,,155,19.38,78,2,8,""Unsuccessful retrieval attempts can enhance subsequent encoding and learning. In three experiments, subjects either attempted to retrieve word pairs prior to studying them (eg, attempting to recall tide–? before studying tide–beach) or did not attempt retrieval and …"""
"138,""M Dresler, A Sandberg, K Ohla, C Bublitz, C Trenado…"",""Non-pharmacological cognitive enhancement"",2013,""…"",""Elsevier"",""https://www.sciencedirect.com/science/article/pii/S0028390812003310"",""https://scholar.google.com/scholar?cites=6781094216331616845&as_sdt=2005&sciodt=0,5&hl=en"",17,""2020-03-10 08:38:30"","""","""","""","""",,,,,138,19.71,23,6,7,""The term “cognitive enhancement” usually characterizes interventions in humans that aim to improve mental functioning beyond what is necessary to sustain or restore good health. While the current bioethical debate mainly concentrates on pharmaceuticals, according to …"""
"152,""OO Adesope, DA Trevisan…"",""Rethinking the use of tests: A meta-analysis of practice testing"",2017,""Review of Educational …"",""journals.sagepub.com"",""https://journals.sagepub.com/doi/abs/10.3102/0034654316689306"",""https://scholar.google.com/scholar?cites=17333313069453252751&as_sdt=2005&sciodt=0,5&hl=en"",18,""2020-03-10 08:38:30"","""","""","""","""",,,,,152,50.67,51,3,3,""The testing effect is a well-known concept referring to gains in learning and retention that can occur when students take a practice test on studied material before taking a final test on the same material. Research demonstrates that students who take practice tests often …"""
"138,""M Ramscar, M Dye, SM McCauley"",""Error and expectation in language learning: The curious absence of"""" mouses"""" in adult speech"",2013,""Language"",""JSTOR"",""https://www.jstor.org/stable/24671957"",""https://scholar.google.com/scholar?cites=8200946603755743060&as_sdt=2005&sciodt=0,5&hl=en"",19,""2020-03-10 08:38:30"","""","""","""","""",,,,,138,19.71,46,3,7,""As children learn their mother tongues, they make systematic errors. For example, English-speaking children regularly say mouses rather than mice. Because children's errors are not explicitly corrected, it has been argued that children could never learn to make the transition …"""
"134,""J Stein, CR Graham"",""Essentials for blended learning: A standards-based guide"",2014,"""",""books.google.com"",""https://books.google.com/books?hl=en&lr=&id=X5-LAgAAQBAJ&oi=fnd&pg=PP1&ots=5toZagWbeB&sig=qqgmOWrWUJ9_jOz3KcDdgEnOwVY"",""https://scholar.google.com/scholar?cites=2489433155726946566&as_sdt=2005&sciodt=0,5&hl=en"",20,""2020-03-10 08:38:30"",""BOOK"","""","""","""",,,,,134,22.33,67,2,6,""Essentials for Blended Learning: A Standards-Based Guide provides a practical, streamlined approach for creating effective learning experiences by blending online activities and the best of face-to-face teaching. This guide is: Easy to use: Clear, jargon-free …"""
"130,""DP Larsen, AC Butler, HL Roediger III"",""Comparative effects of test‐enhanced learning and self‐explanation on long‐term retention"",2013,""Medical Education"",""Wiley Online Library"",""https://onlinelibrary.wiley.com/doi/abs/10.1111/medu.12141"",""https://scholar.google.com/scholar?cites=12375654312207332231&as_sdt=2005&sciodt=0,5&hl=en"",21,""2020-03-10 08:38:30"","""","""","""","""",,,,,130,18.57,43,3,7,""Context Educators often encourage students to engage in active learning by generating explanations for the material being learned, a method called self‐explanation. Studies have also demonstrated that repeated testing improves retention. However, no studies have …"""
"126,""JL Little, EL Bjork, RA Bjork…"",""Multiple-choice tests exonerated, at least of some charges: Fostering test-induced learning and avoiding test-induced forgetting"",2012,""Psychological …"",""journals.sagepub.com"",""https://journals.sagepub.com/doi/abs/10.1177/0956797612443370"",""https://scholar.google.com/scholar?cites=12188241642367428112&as_sdt=2005&sciodt=0,5&hl=en"",22,""2020-03-10 08:38:30"","""","""","""","""",,,,,126,15.75,32,4,8,""Among the criticisms of multiple-choice tests is that—by exposing the correct answer as one of the alternatives—such tests engage recognition processes rather than the productive retrieval processes known to enhance later recall. We tested whether multiple-choice tests …"""
"121,""EL Middleton, MF Schwartz"",""Errorless learning in cognitive rehabilitation: A critical review"",2012,""Neuropsychological Rehabilitation"",""Taylor & Francis"",""https://www.tandfonline.com/doi/abs/10.1080/09602011.2011.639619"",""https://scholar.google.com/scholar?cites=14100151983882786194&as_sdt=2005&sciodt=0,5&hl=en"",23,""2020-03-10 08:38:30"","""","""","""","""",,,,,121,15.13,61,2,8,""Cognitive rehabilitation research is increasingly exploring errorless learning interventions, which prioritise the avoidance of errors during treatment. The errorless learning approach was originally developed for patients with severe anterograde amnesia, who were deemed …"""
"119,""JS Dill"",""The longings and limits of global citizenship education: The moral pedagogy of schooling in a cosmopolitan age"",2013,"""",""books.google.com"",""https://books.google.com/books?hl=en&lr=&id=pegdAAAAQBAJ&oi=fnd&pg=PP2&ots=4Fbk1FVY60&sig=a_wos8NnXFZsOt56P6n6d5XYP8g"",""https://scholar.google.com/scholar?cites=16138043441263941403&as_sdt=2005&sciodt=0,5&hl=en"",24,""2020-03-10 08:38:30"",""BOOK"","""","""","""",,,,,119,17.00,119,1,7,""As the world seemingly gets smaller and smaller, schools around the globe are focusing their attention on expanding the consciousness and competencies of their students to prepare them for the conditions of globalization. Global citizenship education is rapidly …"""
"122,""JD Karpicke, MA Smith"",""Separate mnemonic effects of retrieval practice and elaborative encoding"",2012,""Journal of Memory and Language"",""Elsevier"",""https://www.sciencedirect.com/science/article/pii/S0749596X12000149"",""https://scholar.google.com/scholar?cites=9133932828323726580&as_sdt=2005&sciodt=0,5&hl=en"",25,""2020-03-10 08:38:30"","""","""","""","""",,,,,122,15.25,61,2,8,""Does retrieval practice produce learning because it is an especially effective way to induce elaborative encoding? Four experiments examined this question. Subjects learned word pairs across alternating study and recall periods, and once an item was recalled it was …"""
"119,""D Buehl"",""Developing readers in the academic disciplines"",2017,"""",""books.google.com"",""https://books.google.com/books?hl=en&lr=&id=uLkyDwAAQBAJ&oi=fnd&pg=PP1&ots=YTuK3YfH3j&sig=dWY2V6SE5GCA04eaj9Cfxd7tOrs"",""https://scholar.google.com/scholar?cites=12761594224853069873&as_sdt=2005&sciodt=0,5&hl=en"",26,""2020-03-10 08:38:30"",""BOOK"","""","""","""",,,,,119,39.67,119,1,3,""Being literate in an academic discipline means more than simply being able to read and comprehend text; it means you can think, speak, and write as a historian, scientist, mathematician, or artist. Doug Buehl strips away the one-size-fits-all approach to content …"""
"119,""JR Blunt, JD Karpicke"",""Learning with retrieval-based concept mapping."",2014,""Journal of Educational Psychology"",""psycnet.apa.org"",""https://psycnet.apa.org/record/2014-05951-001"",""https://scholar.google.com/scholar?cites=8000189867868658842&as_sdt=2005&sciodt=0,5&hl=en"",27,""2020-03-10 08:38:30"","""","""","""","""",,,,,119,19.83,60,2,6,""Students typically create concept maps while they view the material they are trying to learn. In these circumstances, concept mapping serves as an elaborative study activity—students are not required to retrieve the material they are learning. In 2 experiments, we examined …"""
"119,""B Jonsson, M Norqvist, Y Liljekvist, J Lithner"",""Learning mathematics through algorithmic and creative reasoning"",2014,""The Journal of Mathematical …"",""Elsevier"",""https://www.sciencedirect.com/science/article/pii/S0732312314000509"",""https://scholar.google.com/scholar?cites=4471906747514346164&as_sdt=2005&sciodt=0,5&hl=en"",28,""2020-03-10 08:38:30"",""HTML"","""","""","""",,,,,119,19.83,30,4,6,""There are extensive concerns pertaining to the idea that students do not develop sufficient mathematical competence. This problem is at least partially related to the teaching of procedure-based learning. Although better teaching methods are proposed, there are very …"""
"105,""RL DeHaan"",""Teaching creative science thinking"",2011,""Science"",""science.sciencemag.org"",""https://science.sciencemag.org/content/334/6062/1499.short"",""https://scholar.google.com/scholar?cites=18066895135208492395&as_sdt=2005&sciodt=0,5&hl=en"",29,""2020-03-10 08:38:30"","""","""","""","""",,,,,105,11.67,105,1,9,""Scientists frequently encounter ill-structured problems that can have multiple paths to multiple solutions (1). To approach such problems,“higher-order” mental operations such as analysis, synthesis, and abstraction are key. But, in addition, creative thinking—the most …"""
"107,""M Lehman, MA Smith, JD Karpicke"",""Toward an episodic context account of retrieval-based learning: Dissociating retrieval practice and elaboration."",2014,""Journal of Experimental …"",""psycnet.apa.org"",""https://psycnet.apa.org/record/2014-15699-001"",""https://scholar.google.com/scholar?cites=16164596030788184306&as_sdt=2005&sciodt=0,5&hl=en"",30,""2020-03-10 08:38:30"","""","""","""","""",,,,,107,17.83,36,3,6,""We tested the predictions of 2 explanations for retrieval-based learning; while the elaborative retrieval hypothesis assumes that the retrieval of studied information promotes the generation of semantically related information, which aids in later retrieval (Carpenter …"""
"93,""J Wilkowski, A Deutsch, DM Russell"",""Student skill and goal achievement in the mapping with google MOOC"",2014,""… of the first ACM conference on …"",""dl.acm.org"",""https://dl.acm.org/doi/abs/10.1145/2556325.2566240"",""https://scholar.google.com/scholar?cites=13072445487576198707&as_sdt=2005&sciodt=0,5&hl=en"",31,""2020-03-10 08:38:30"","""","""","""","""",,,,,93,15.50,31,3,6,""Students who registered for the Mapping with Google massive open online course (MOOC) were asked several questions during the registration process to identify prior experience with eleven skills as well as their goals for registering for the course. Students selected goals …"""
"95,""B Pastötter, KHT Bäuml"",""Retrieval practice enhances new learning: the forward effect of testing"",2014,""Frontiers in psychology"",""frontiersin.org"",""https://www.frontiersin.org/articles/10.3389/fpsyg.2014.00286"",""https://scholar.google.com/scholar?cites=3271982444586726686&as_sdt=2005&sciodt=0,5&hl=en"",32,""2020-03-10 08:38:30"",""HTML"","""","""","""",,,,,95,15.83,48,2,6,""In the last couple of years, there has been a dramatic increase in laboratory research examining the benefits of recall testing on long-term learning and retention. This work was largely on the backward effect of testing, which shows that retrieval practice on previously …"""
"95,""MA Smith, JD Karpicke"",""Retrieval practice with short-answer, multiple-choice, and hybrid tests"",2014,""Memory"",""Taylor & Francis"",""https://www.tandfonline.com/doi/abs/10.1080/09658211.2013.831454"",""https://scholar.google.com/scholar?cites=273766387241212064&as_sdt=2005&sciodt=0,5&hl=en"",33,""2020-03-10 08:38:30"","""","""","""","""",,,,,95,15.83,48,2,6,""Retrieval practice improves meaningful learning, and the most frequent way of implementing retrieval practice in classrooms is to have students answer questions. In four experiments (N= 372) we investigated the effects of different question formats on learning. Students read …"""
"89,""DP Larsen, AC Butler, AL Lawson…"",""The importance of seeing the patient: test-enhanced learning with standardized patients and written tests improves clinical application of knowledge"",2013,""Advances in Health …"",""Springer"",""https://link.springer.com/article/10.1007/s10459-012-9379-7"",""https://scholar.google.com/scholar?cites=9256232622360149324&as_sdt=2005&sciodt=0,5&hl=en"",34,""2020-03-10 08:38:30"","""","""","""","""",,,,,89,12.71,22,4,7,""Previous research has shown that repeated retrieval with written tests produces superior long-term retention compared to repeated study. However, the degree to which this increased retention transfers to clinical application has not been investigated. In addition …"""
"93,""LB Raine, HK Lee, BJ Saliba, L Chaddock-Heyman…"",""The influence of childhood aerobic fitness on learning and memory"",2013,""PloS one"",""ncbi.nlm.nih.gov"",""https://www.ncbi.nlm.nih.gov/pmc/articles/PMC3770671/"",""https://scholar.google.com/scholar?cites=3625890495930165654&as_sdt=2005&sciodt=0,5&hl=en"",35,""2020-03-10 08:38:30"",""HTML"","""","""","""",,,,,93,13.29,19,5,7,""Purpose To investigate the relationship between aerobic fitness, learning, and memory on a task that involved remembering names and locations on a fictitious map. Different learning strategies and recall procedures were employed to better understand fitness effects on …"""
"87,""BA Oakley"",""A mind for numbers: How to excel at math and science (even if you flunked algebra)"",2014,"""",""books.google.com"",""https://books.google.com/books?hl=en&lr=&id=Jv3YCwAAQBAJ&oi=fnd&pg=PA51&ots=VNOFkUUXuK&sig=R8X7Bkjsrke4QYRIA8Q4VZ5FAfs"",""https://scholar.google.com/scholar?cites=5397992940387265318&as_sdt=2005&sciodt=0,5&hl=en"",36,""2020-03-10 08:38:30"",""BOOK"","""","""","""",,,,,87,14.50,87,1,6,""Whether you are a student struggling to fulfil a math or science requirement, or an established professional embarking on a career change that requires a higher level of math competency, A Mind for Numbersoffers the necessary tools for getting a better grasp on this …"""
"84,""IM Kinchin"",""Concept mapping as a learning tool in higher education: A critical analysis of recent reviews"",2014,""The Journal of Continuing Higher Education"",""Taylor & Francis"",""https://www.tandfonline.com/doi/abs/10.1080/07377363.2014.872011"",""https://scholar.google.com/scholar?cites=16083754645118845434&as_sdt=2005&sciodt=0,5&hl=en"",37,""2020-03-10 08:38:30"","""","""","""","""",,,,,84,14.00,84,1,6,""This article aims to reexamine conclusions drawn by recent analyses of the literature on concept mapping as an educational tool by considering the wider literature on curriculum development. This is with the aim of enhancing the application of concept mapping to higher …"""
