"Cites,Authors,Title,Year,Source,Publisher,ArticleURL,CitesURL,GSRank,QueryDate,Type,DOI,ISSN,CitationURL,Volume,Issue,StartPage,EndPage,ECC,CitesPerYear,CitesPerAuthor,AuthorCount,Age,Abstract"
"0,""CNA Guran, J Lehmann-Grube…"",""Retrieval Practice Improves Recollection-Based Memory Over a Seven-Day Period in Younger and Older Adults"",2019,""Frontiers in …"",""ncbi.nlm.nih.gov"",""https://www.ncbi.nlm.nih.gov/pmc/articles/PMC6990689/"","""",616,""2020-03-10 08:38:30"",""HTML"","""","""","""",,,,,0,0.00,0,3,1,""Retrieving information improves subsequent memory performance more strongly than restudying. However, despite recent evidence for this retrieval practice effect (RPE), the temporal dynamics, age-related changes, and their possible interactions remain unclear …"""
"1,""KJ Cavanaugh"",""Predicting Score Change: An Empirical Investigation of Cheating on Unproctored Employment Tests"",2018,"""",""digitalcommons.odu.edu"",""https://digitalcommons.odu.edu/psychology_etds/66/"",""https://scholar.google.com/scholar?cites=7352398312485155410&as_sdt=2005&sciodt=0,5&hl=en"",617,""2020-03-10 08:38:30"","""","""","""","""",,,,,1,0.50,1,1,2,""Unproctored internet testing (UIT) is used widely to administer employment tests (Fallaw, Solomonson, & McClelland, 2009), although cognitively loaded tests delivered by UIT are suspected to offer test takers greater opportunities to cheat and increase the risk of test taker …"""
"0,""W Liu, N Kohn, G Fernández"",""Probing the neural dynamics of mnemonic representations in humans"",2019,""bioRxiv"",""biorxiv.org"",""https://www.biorxiv.org/content/10.1101/803718v1.abstract"","""",618,""2020-03-10 08:38:30"","""","""","""","""",,,,,0,0.00,0,3,1,""Memories are not stored as static engrams, but as dynamic representations affected by processes occurring after initial encoding or even consolidation. How the modulation of memory traces after their formation is reflected in the neural activity during subsequent …"""
"0,""G Schmidt Henk, I Rotgans Jerome…"",""Knowledge Reconsolidation: A Psychological Foundation for Team-Based Learning"",2004,""Education"",""researchgate.net"",""https://www.researchgate.net/profile/Preman_Rajalingam/publication/333513475_Knowledge_Reconsolidation_A_Psychological_Foundation_for_Team-Based_Learning/links/5cff1765299bf13a384c73f4/Knowledge-Reconsolidation-A-Psychological-Foundation-for-Team-Based-Learning.pdf"","""",619,""2020-03-10 08:38:30"",""PDF"","""","""","""",,,,,0,0.00,0,3,16,""Although team-based learning is a popular instructional approach, little is known about its psychological foundation. In this Perspective, the authors propose a theoretical account of the psychological mechanisms through which team-based learning works. They suggest a …"""
"0,""RL Moryl, F Gabriele, J Desvira"",""HeadsUp! Econ: Making exam review sessions fun and effective"",2019,""The Journal of Economic …"",""Taylor & Francis"",""https://www.tandfonline.com/doi/abs/10.1080/00220485.2019.1654953"","""",620,""2020-03-10 08:38:30"","""","""","""","""",,,,,0,0.00,0,3,1,""In this article, the authors describe an innovative charades-based educational game, HeadsUp! Econ, and its use for effective economics instruction. Results of a self-assessment survey of students demonstrate that implementing HeadsUp! Econ as an active learning …"""
"0,""R Laukkonen, JMI Leggett, R Gallagher, H Biddell…"",""The Science of Mindfulness-Based Interventions and Learning: A Review for Educators"",2020,"""",""mindrxiv.org"",""https://mindrxiv.org/6g9uq/download/?format=pdf"","""",621,""2020-03-10 08:38:30"",""PDF"","""","""","""",,,,,0,0.00,0,5,1,""Is there sufficient evidence that mindfulness training is ready to be implemented in schools? Going beyond the relatively comprehensive literature on mindfulness and mental health, here we investigate whether mindfulness can help students learn. We begin by drawing on …"""
"0,""KA Coria"",""Notetaking in the lecture theatre-examining the impacts of popular encoding strategies"",2018,"""",""eprints.soton.ac.uk"",""https://eprints.soton.ac.uk/435771/"","""",622,""2020-03-10 08:38:30"","""","""","""","""",,,,,0,0.00,0,1,2,""Lecture slide handout annotation has largely replaced the once prevalent practice of longhand notetaking. What impact has this had on student learning? In Experiment 1, students viewed two lectures, one presented fluently and the other disfluently, whilst either …"""
"0,""SR Hinze, J Wiley, JW Pellegrino"",""Journal of Memory and Languag e"",2013,"""","""","""","""",623,""2020-03-10 08:38:30"",""CITATION"","""","""","""",,,,,0,0.00,0,3,7,"""""
"0,""J Lee, M Cowan, L Gorman"",""A Pilot Study Comparing Cued Versus Recognition Recall Question Design on Medical Student Utilization, Effectiveness, and Perceptions of Pharmacology …"",2019,""Medical Science Educator"",""Springer"",""https://link.springer.com/article/10.1007/s40670-019-00775-5"","""",624,""2020-03-10 08:38:30"","""","""","""","""",,,,,0,0.00,0,3,1,""Although games are used for active learning, research is lacking on how design impacts learning, engagement, and utilization in medical students. This pilot study compared pharmacology educational games designed with cued recall questions with a recognition …"""
"0,""CD Smith, A Dai, D Kenwright, R Grainger"",""PeerWise and Pathology: Discontinuing a teaching innovation that did not achieve its potential"",2020,""MedEdPublish"",""mededpublish.org"",""https://www.mededpublish.org/manuscripts/2738"","""",625,""2020-03-10 08:38:30"",""HTML"","""","""","""",,,,,0,0.00,0,4,1,""Methods Overall, an instrumental case-study design with the structure of sequential multiple case studies was used. Across three years fourth year medical students were required to write and answer MCQs. In 2016 students were provided with advice for writing questions …"""
"0,""GA MAGEE"",""Think-Pair-Share-Compare: An organizational principle for deeper learning"",2017,"""",""opar.ehime-u.ac.jp"",""https://web.opar.ehime-u.ac.jp/wp/wp-content/uploads/2017/05/J15-18_glenn.pdf"","""",626,""2020-03-10 08:38:30"",""PDF"","""","""","""",,,,,0,0.00,0,1,3,""Broadly speaking, the use of routines in EFL classrooms can be characterized on a cline toward either synthetic or analytic instruction (Beglar & Hunt, 2002). Synthetic instructional routines direct learner attention toward grammar, words, and categorization, whereas …"""
"0,""I So"",""The Testing Effect"",2013,""The SAGE Handbook of Applied Memory"",""books.google.com"",""https://books.google.com/books?hl=en&lr=&id=NvRcCwAAQBAJ&oi=fnd&pg=PT204&ots=4OaWnkll_L&sig=MnzR6IVL9gDE9C49pbPoBv3wFto"","""",627,""2020-03-10 08:38:30"","""","""","""","""",,,,,0,0.00,0,1,7,""The basic principle behind US Memory Champion Nelson Dellis's approach to remembering described above is that the best way to remember information over the long term is to practice retrieval of that information in the interim. Specifically, as studied in the laboratory …"""
"0,""MR Massey"",""Approval Page"",,""researchgate.net"","""",""https://www.researchgate.net/profile/Mary_Massey3/publication/307630178_The_Impact_of_Training_Teachers_in_Multiple-Intelligences_Instructional_Strategies/links/57cd9faf08ae057987aab35e"","""",628,""2020-03-10 08:38:30"",""DOC"","""","""","""",,,,,0,0.00,0,1,,""Abstract The Impact of Training Teachers in Multiple-Intelligences Instructional Strategies. Mary R. Massey, 2015: Applied Dissertation, Nova Southeastern University, Abraham S. Fischler School of Education. ERIC Descriptors: Professional Development, Multiple …"""
"0,""E Sundell"",""Helping students remember: catalytic knowledge and knowledge outlines with visual mnemonics"",2015,"""",""diva-portal.org"",""http://www.diva-portal.org/smash/record.jsf?pid=diva2:862206"","""",629,""2020-03-10 08:38:30"","""","""","""","""",,,,,0,0.00,0,1,5,""To recall educational content from a lecture or textbook is an efficient way to learn (Karpicke & Blunt, 2011), which is referred to as retrieval practice (Karpicke & Roediger, 2008). It is currently seldom used among students (Karpicke, Butler, & Roediger, 2009), even though it …"""
"0,""SSH Wong, SWH Lim"",""From JOLs to JOLs+: Directing learners' attention in retrieval practice to boost integrative argumentation."",2019,""Journal of Experimental Psychology …"",""psycnet.apa.org"",""https://psycnet.apa.org/record/2019-22741-001"","""",630,""2020-03-10 08:38:30"","""","""","""","""",,,,,0,0.00,0,2,1,""The effects of retrieval practice on complex, meaningful learning outcomes that require more than just basic recall are of ongoing interest in the test-enhanced learning literature. Across two experiments, we investigated the extent that retrieval practice boosts integrative …"""
"0,""LB Leonarda, J Karpickea, P Deevya, C Webera…"",""Retrieval-Based Word Learning in Young Typically Developing Children and Children with Developmental Language Disorder I: The Benefits of Repeated …"",,""learninglab.psych.purdue.edu"","""",""http://learninglab.psych.purdue.edu/downloads/inpress_Leonard_etal_JSLHR.pdf"","""",631,""2020-03-10 08:38:30"",""PDF"","""","""","""",,,,,0,0.00,0,5,,""Purpose: Scholars have long noted that retention improves significantly when learners frequently test themselves on the new material rather than engage in continuous study with no intermittent testing. In this study, we apply the notion of repeated testing or retrieval to the …"""
"0,""A Jemstedt"",""Can the testing effect, in part, be explained by organizational benefits?"",2013,"""",""diva-portal.org"",""http://www.diva-portal.org/smash/record.jsf?pid=diva2:620725"","""",632,""2020-03-10 08:38:30"","""","""","""","""",,,,,0,0.00,0,1,7,""The testing effect refers to the phenomenon that, relative to restudying, being tested on a previously learned material leads to better retention. The present study investigated the hypothesis that part of the testing effect in free recall, can be explained by increased memory …"""
"0,""CJ Tan, TY Lim, CW Bong, TK Liew"",""A multi-objective evolutionary algorithm-based soft computing model for educational data mining"",2017,""Asian Association of Open …"",""emerald.com"",""https://www.emerald.com/insight/content/doi/10.1108/AAOUJ-01-2017-0012/full/html"","""",633,""2020-03-10 08:38:30"",""HTML"","""","""","""",,,,,0,0.00,0,4,3,""Purpose The purpose of this paper is to propose a soft computing model based on multi-objective evolutionary algorithm (MOEA), namely, modified micro genetic algorithm (MmGA) coupled with a decision tree (DT)-based classifier, in classifying and optimising the students' …"""
"0,""A Fenney, TD Lee"",""The Role of Enactment in Learning American Sign Language in Younger and Older Adults"",2012,""ISRN Geriatrics"",""downloads.hindawi.com"",""http://downloads.hindawi.com/journals/isrn.geriatrics/2013/285860.pdf"","""",634,""2020-03-10 08:38:30"",""PDF"","""","""","""",,,,,0,0.00,0,2,8,""“Tell me, and I will forget. Show me, and I may remember. Involve me, and I will understand”(Confucius, 450 BC). Philosophers and scientists alike have pondered the question of the mind-body link for centuries. Recently the role of motor information has been examined …"""
"0,""RE Laukkonen, JM Leggett, RM Gallagher, HL Biddell…"",""Future of Education and Skills 2030: Curriculum Analysis"",1990,"""",""cmhp.ucsb.edu"",""https://www.cmhp.ucsb.edu/sites/default/files/2020-01/Laukkonen%20et%20al.%20%282019%29%20The%20science%20of%20mindfulness-based%20interventions%20and%20learning.pdf"","""",635,""2020-03-10 08:38:30"",""PDF"","""","""","""",,,,,0,0.00,0,5,30,""Is there sufficient evidence that mindfulness training is ready to be implemented in schools? Going beyond the relatively comprehensive literature on mindfulness and mental health, here we investigate whether mindfulness can help students learn. We begin by drawing on …"""
"0,""K Lukin"",""Leveraging Micro-Stories to Build Engagement, Inclusion, and Neural Networking in Immunology Education"",2019,""Frontiers in Immunology"",""ncbi.nlm.nih.gov"",""https://www.ncbi.nlm.nih.gov/pmc/articles/PMC6893969/"","""",636,""2020-03-10 08:38:30"",""HTML"","""","""","""",,,,,0,0.00,0,1,1,""Storytelling is a highly effective strategy for delivering course content. It can provide real-world contexts and the relevance students desire. Through personal connections to the narrative details, anecdotes facilitate the incorporation of content into pre-existing …"""
"0,""C Rode, M McCart, A Glang"",""School-based Interventions"",,""researchgate.net"","""",""https://www.researchgate.net/profile/Ann_Glang/publication/326015473_School-based_Interventions/links/5da46beb45851553ff8f6ac5/School-based-Interventions.pdf"","""",637,""2020-03-10 08:38:30"",""PDF"","""","""","""",,,,,0,0.00,0,3,,""In mathematics, executive WM is essential for estimating, counting, keeping track of multistep procedures, and selecting appropriate problem-solving strategies. 17 Geary and Hoard18 concluded that developmental delays and deficits in mathematics “can be …"""
"0,""AM Wilkinson, ACG Hall, EE Hogan"",""Effects of retrieval practice and presentation modality on verbal learning: testing the limits of the testing effect"",2019,""Memory"",""Taylor & Francis"",""https://www.tandfonline.com/doi/abs/10.1080/09658211.2019.1632349"","""",638,""2020-03-10 08:38:30"","""","""","""","""",,,,,0,0.00,0,3,1,""The testing effect refers to improved memory after retrieval practice and has been researched primarily with visual stimuli. In two experiments, we investigated whether the testing effect can be replicated when the to-be-learned information is presented auditorily, or …"""
"0,""T Tempel, C Frings"",""Testing enhances motor practice"",2019,""Memory & cognition"",""Springer"",""https://link.springer.com/article/10.3758/s13421-019-00932-6"","""",639,""2020-03-10 08:38:30"","""","""","""","""",,,,,0,0.00,0,2,1,""We investigated how retrieval of a set of newly learned motor sequences influences subsequent learning of another set of motor sequences. In four experiments, retrieval reduced an acceleration of movement execution over subsequent study trials. This relative …"""
"0,""Z WANG, J ZHANG"",""The mechanism of the retrieval practice effect: From encoding, retrieval to integration of both"",2017,""Advances in Psychological Science"",""journal.psych.ac.cn"",""http://journal.psych.ac.cn/xlkxjz/EN/Y2017/V25/I9/1512"","""",640,""2020-03-10 08:38:30"","""","""","""","""",,,,,0,0.00,0,2,3,""Abstract Retrieval Practice Effect (RPE) means that compared with restudy in the same amount of time, retrieval practice (even without feedback) can effectively help people achieve a better performance in the final memory test. In the early researches, RPE was …"""
"0,""A Poyner"",""Mathematical Literacy and the Secondary Student"",2018,"""",""scholarworks.uno.edu"",""https://scholarworks.uno.edu/honors_theses/122/"","""",641,""2020-03-10 08:38:30"","""","""","""","""",,,,,0,0.00,0,1,2,""Public education is a continually evolving field, with new research, policies, and practices explored by professionals who are driven to provide America's youth with high-quality education. Research literature since 2000 has highlighted the importance of disciplinary …"""
"0,""LP Beaudoin"",""Meta-effectiveness Excerpts from Cognitive Productivity: Using Knowledge to Become Profoundly Effective"",,""sfu.ca"","""",""http://www.sfu.ca/~lpb/tr/meta-effectiveness_and_effectance.pdf"","""",642,""2020-03-10 08:38:30"",""PDF"","""","""","""",,,,,0,0.00,0,1,,""I recently wrote a blog post containing some importants concepts for understanding adult development of competence (including “learning to learn”). The overarching concept of that topic, and Cognitive Productivity, is meta-effectiveness, ie, the abilities and dispositions (or “mindware”) to use knowledge …"""
"0,""FJ Guzmán-Muñoz"",""Effects of making errors in learning a foreign language"",2020,""Journal of Cognitive Psychology"",""Taylor & Francis"",""https://www.tandfonline.com/doi/abs/10.1080/20445911.2020.1711766"","""",643,""2020-03-10 08:38:30"","""","""","""","""",,,,,0,0.00,0,1,1,""ABSTRACT Kornell, Hays, and Bjork ([2009]. Unsuccessful retrieval attempts enhance subsequent learning. Journal of Experimental Psychology: Learning, Memory, and Cognition, 35, 989–998) showed that incorrect guesses do not necessarily harm and might …"""
"0,""CL Hall, DR Howard"",""Shaking It Up in the Classroom: Coupling Biotremology and Active Learning Pedagogy to Promote Authentic Discovery"",2019,""Biotremology: Studying Vibrational Behavior"",""Springer"",""https://link.springer.com/chapter/10.1007/978-3-030-22293-2_22"","""",644,""2020-03-10 08:38:30"","""","""","""","""",,,,,0,0.00,0,2,1,""Active learning methods are instructional techniques that create an environment for increased student engagement in the process of learning. Whether employed in the lecture hall or in the teaching laboratory, these pedagogical methods have been shown to improve …"""
"2,""J Shi, JK Knight, H Chun, NA Guild…"",""Using Pre-Assessment and In-Class Questions to Change Student Understanding of Molecular Movements"",2017,""Journal of microbiology …"",""ncbi.nlm.nih.gov"",""https://www.ncbi.nlm.nih.gov/pmc/articles/PMC5410762/"",""https://scholar.google.com/scholar?cites=7819786566809329753&as_sdt=2005&sciodt=0,5&hl=en"",645,""2020-03-10 08:38:30"",""HTML"","""","""","""",,,,,2,0.67,0,5,3,""Understanding how different types of molecules move through cell membranes is a fundamental part of cell biology. To identify and address student misconceptions surrounding molecular movement through cell membranes, we surveyed student …"""
"0,""JRM Nückles, J Roelle"",""Generative Learning vs. Retrieval Practice in Learning From Text: The Cohesion and Elaboration of the Text Matters"",,""researchgate.net"","""",""https://www.researchgate.net/profile/Julian_Roelle/publication/330384428_Generative_Learning_vs_Retrieval_Practice_in_Learning_From_Text_The_Cohesion_and_Elaboration_of_the_Text_Matters/links/5c3f2c59458515a4c72a6b94/Generative-Learning-vs-Retrieval-Practice-in-Learning-From-Text-The-Cohesion-and-Elaboration-of-the-Text-Matters.pdf"","""",646,""2020-03-10 08:38:30"",""PDF"","""","""","""",,,,,0,0.00,0,2,,""Both generative learning tasks and retrieval practice tasks can serve as a beneficial follow-up to an initial study phase in which learners have studied new learning material. However, research that compares the effects of these two types of learning tasks is scarce. Therefore, it …"""
"0,""M Kubsch, J Nordine, D Fortus, J Krajcik…"",""Supporting Students in Using Energy Ideas to Interpret Phenomena: The Role of an Energy Representation"",2019,""International Journal of …"",""Springer"",""https://link.springer.com/article/10.1007/s10763-019-10035-y"","""",647,""2020-03-10 08:38:30"",""HTML"","""","""","""",,,,,0,0.00,0,5,1,""In the sciences, energy is an important idea to get insight into phenomena, as energy can help to reveal hidden systems and processes. However, students commonly struggle to use energy ideas to interpret and explain phenomena. To support students in using energy …"""
"0,""M Shaw"",""A-Moms: How to Raise Competitive Award-Winning Students"",2015,"""",""BookBaby"","""","""",648,""2020-03-10 08:38:30"",""CITATION"","""","""","""",,,,,0,0.00,0,1,5,"""""
"0,""AM Smith"",""Examining the Role of Retrieval Practice in Improving Memory Accessibility Under Stress"",2018,"""",""search.proquest.com"",""http://search.proquest.com/openview/73a3fe56a092a3cfbddc3237e27e4af2/1?pq-origsite=gscholar&cbl=18750&diss=y"","""",649,""2020-03-10 08:38:30"","""","""","""","""",,,,,0,0.00,0,1,2,""Psychological stress has been shown to impair episodic memory retrieval. The goal of this dissertation was to investigate one method of improving memory accessibility under stress, by using the learning strategy retrieval practice to create stress-resistant memories. In …"""
"0,""JW Bonner"",""Adopting reform-based pedagogy in post-secondary microbiology education"",2016,"""",""jewlscholar.mtsu.edu"",""https://jewlscholar.mtsu.edu/handle/mtsu/5142"","""",650,""2020-03-10 08:38:30"","""","""","""","""",,,,,0,0.00,0,1,4,""The research presented here was conducted in two parts under the same context during one semester of a post-secondary microbiology course. First, a quantitative study was conducted to compare collaborative and individual completion of a reform-based instructional strategy …"""
"0,""Y LIU, C GAO, B LI, C GUO"",""The underlying mechanism behind testing effect: Perspective from the episodic context account"",2016,""Advances in Psychological Science"",""journal.psych.ac.cn"",""http://journal.psych.ac.cn/xlkxjz/EN/abstract/abstract3499.shtml"","""",651,""2020-03-10 08:38:30"","""","""","""","""",,,,,0,0.00,0,4,4,""Testing effect refers to the improvement of subsequent memory performance for test compared to restudy. Most theories argue that testing effect is a function of the retrieval mechanism. Recently, many research findings have supported elaborative retrieval theory …"""
"0,""O Razumnikova"",""Age effect on relationships between inhibitory functions of executive attention system and visual memory"",2019,""Experimental Psychology (Russia)"",""psyjournals.ru"",""http://psyjournals.ru/en/exp/2019/n2/Razumnikova.shtml"","""",652,""2020-03-10 08:38:30"","""","""","""","""",,,,,0,0.00,0,1,1,""It is known that aging is accompanied by a weakening of the processes of inhibition in the central nervous system, but with a significant individual variability. In connection with this, the purpose of the study was to study the patterns of these age effects using experimental …"""
"0,""DW Chen"",""An investigation of pedagogical interventions within the productive failure methodology"",2018,"""",""smartech.gatech.edu"",""https://smartech.gatech.edu/handle/1853/59867"","""",653,""2020-03-10 08:38:30"","""","""","""","""",,,,,0,0.00,0,1,2,""The assistance dilemma asks how learning environments should “balance information or assistance giving and withholding”(Koedinger & Aleven, 2007, p. 239). Minimal guidance (MG) methods posit that students learn best when exploring problems freely, while direct …"""
"0,""D Davis, R Kizilcec, C Hauff…"",""Scaling Effective Learning Strategies: Retrieval Practice and Long-Term Knowledge Retention in MOOCs"",2018,""Journal of Learning …"",""epress.lib.uts.edu.au"",""https://epress.lib.uts.edu.au/index.php/JLA/article/view/6098"","""",654,""2020-03-10 08:38:30"","""","""","""","""",,,,,0,0.00,0,4,2,""Scientific evidence for effective learning strategies is primarily derived from studies conducted in controlled laboratory or classroom settings with homogeneous populations. Large-scale online learning environments such as MOOCs provide an opportunity to …"""
"0,""D Zapata-Rivera, J Vassileva"",""Exploring Opportunities for Caring Assessments"",,""ceur-ws.org"","""",""http://ceur-ws.org/Vol-2354/w3preface.pdf"","""",655,""2020-03-10 08:38:30"",""PDF"","""","""","""",,,,,0,0.00,0,2,,""The notion of intelligent systems that “care” about students is at the center of ITS research [1-3]. A variety of adaptive learning systems that “care” have been developed in the past [4, 5]. These systems make use of student/user models to adapt their interactions to a particular …"""
"0,""L Mbangata"",""Computing departments' academics' perceptions on the impact of Learning and Management Systems on academic performance"",2019,"""",""openscholar.dut.ac.za"",""http://openscholar.dut.ac.za/handle/10321/3346"","""",656,""2020-03-10 08:38:30"","""","""","""","""",,,,,0,0.00,0,1,1,""There are currently more than 500 commercial e-Learning software packages and 300 educational e-Learning software packages, but the surprising fact is that academic failure remains high in universities, especially for first-year students, despite all these advances …"""
"0,""C Green, E Golonka, N Adams, C Bonilla, M Clark…"",""Objectives, methods, and techniques for 'surge'Somali acquisition and instruction"",2013,"""","""","""","""",657,""2020-03-10 08:38:30"",""CITATION"","""","""","""",,,,,0,0.00,0,6,7,"""""
"0,""KJH Dirkx, L Kester, PA Kirschner"",""THIS ARTICLE HAS BEEN PUBLISHED IN THE JOURNAL OF EDUCATIONAL"",,""core.ac.uk"","""",""https://core.ac.uk/download/pdf/55539350.pdf"","""",658,""2020-03-10 08:38:30"",""PDF"","""","""","""",,,,,0,0.00,0,3,,""In this study, it was explored whether a testing-effect occurs not only retention of facts but also for application of principles and procedures. For that purpose, thirty-eight high-school students either repeatedly studied a text on probability calculations (SSSS), or studied the …"""
"0,""T Dean Jr, LM Bell"",""Nelson Pediatrics Board Review E-Book: Certification and Recertification"",2018,"""",""books.google.com"",""https://books.google.com/books?hl=en&lr=&id=kyx1DwAAQBAJ&oi=fnd&pg=PP1&ots=UIEB-Sh2si&sig=aT2PZ3sVL6vcTL6o5wEX95rkAdA"","""",659,""2020-03-10 08:38:30"",""BOOK"","""","""","""",,,,,0,0.00,0,2,2,""Review and retain the information you need for success on the boards with Nelson Pediatrics Board Review: Certification and Recertification. This highly practical review tool follows the American Board of Pediatrics (ABP) general pediatrics content outline, with …"""
"0,""KJ Williams, E Stevens, S Vaughn"",""RTI in Secondary Schools: Current Issues and Recommendations"",2018,""… and Multi-Tiered Systems of Support"",""Routledge"","""","""",660,""2020-03-10 08:38:30"",""CITATION"","""","""","""",,,,,0,0.00,0,3,2,"""""
