"Cites,Authors,Title,Year,Source,Publisher,ArticleURL,CitesURL,GSRank,QueryDate,Type,DOI,ISSN,CitationURL,Volume,Issue,StartPage,EndPage,ECC,CitesPerYear,CitesPerAuthor,AuthorCount,Age,Abstract"
"12,""SC Pan, CM Wong, ZE Potter, J Mejia, TC Rickard"",""Does test-enhanced learning transfer for triple associates?"",2016,""Memory & Cognition"",""Springer"",""https://link.springer.com/article/10.3758/s13421-015-0547-x"",""https://scholar.google.com/scholar?cites=12813123072695855558&as_sdt=2005&sciodt=0,5&hl=en"",186,""2020-03-10 08:38:30"",""HTML"","""","""","""",,,,,12,3.00,2,5,4,""Test-enhanced learning and transfer for triple-associate word stimuli was assessed in three experiments. In each experiment, training and final-test trials involved the presentation of two words per triple associate (triplet), with the third word having to be retrieved. In …"""
"13,""MC Trumbo, KA Leiting, MA McDaniel…"",""Effects of reinforcement on test-enhanced learning in a large, diverse introductory college psychology course."",2016,""Journal of Experimental …"",""psycnet.apa.org"",""https://psycnet.apa.org/record/2016-18384-001"",""https://scholar.google.com/scholar?cites=6744144056580136034&as_sdt=2005&sciodt=0,5&hl=en"",187,""2020-03-10 08:38:30"","""","""","""","""",,,,,13,3.25,3,4,4,""A robust finding within laboratory research is that structuring information as a test confers benefit on long-term retention—referred to as the testing effect. Although well characterized in laboratory environments, the testing effect has been explored infrequently within …"""
"14,""KA Rawson, J Dunlosky"",""How effective is example generation for learning declarative concepts?"",2016,""Educational Psychology Review"",""Springer"",""https://link.springer.com/article/10.1007/s10648-016-9377-z"",""https://scholar.google.com/scholar?cites=7859236425609162017&as_sdt=2005&sciodt=0,5&hl=en"",188,""2020-03-10 08:38:30"","""","""","""","""",,,,,14,3.50,7,2,4,""Declarative concepts (ie, key terms and corresponding definitions for abstract concepts) represent foundational knowledge that students learn in many content domains. Thus, investigating techniques to enhance concept learning is of critical importance. Various …"""
"12,""PR Husmann, JB Barger…"",""Study skills in anatomy and physiology: Is there a difference?"",2016,""Anatomical sciences …"",""Wiley Online Library"",""https://anatomypubs.onlinelibrary.wiley.com/doi/abs/10.1002/ase.1522"",""https://scholar.google.com/scholar?cites=13809252550704346241&as_sdt=2005&sciodt=0,5&hl=en"",189,""2020-03-10 08:38:30"","""","""","""","""",,,,,12,3.00,4,3,4,""Many factors influence the way individual students study, including but not limited to: previous coursework, attitudes toward the class (motivation, intimidation, risk, etc.), metacognition, and work schedules. However, little of this research has involved medical …"""
"12,""GP Zipp, C Maher, AV D'Antoni"",""Mind mapping: Teaching and learning strategy for physical therapy curricula"",2015,""Journal of Physical Therapy …"",""journals.lww.com"",""https://journals.lww.com/jopte/Fulltext/2015/29010/Mind_Mapping__Teaching_and_Learning_Strategy_for.8.aspx"",""https://scholar.google.com/scholar?cites=7560028951479586900&as_sdt=2005&sciodt=0,5&hl=en"",190,""2020-03-10 08:38:30"","""","""","""","""",,,,,12,2.40,4,3,5,""Background and Purpose. As physical therapist educators, creating an environment that engages students in their learning journey is our primary role. One teaching and learning strategy that has recently emerged in higher education is mind mapping (MM). The purpose …"""
"14,""M McAndrew, CS Morrow, L Atiyeh…"",""Dental student study strategies: Are self-testing and scheduling related to academic performance?"",2016,""Journal of dental …"",""Am Dental Educ Assoc"",""http://www.jdentaled.org/content/80/5/542.short"",""https://scholar.google.com/scholar?cites=1164421588092404964&as_sdt=2005&sciodt=0,5&hl=en"",191,""2020-03-10 08:38:30"","""","""","""","""",,,,,14,3.50,4,4,4,""Self-testing, a strategy wherein a student actively engages in creating questions and answers from study materials to assist with studying, has been found to be especially advantageous because it enhances future retrieval of information. Studies have found …"""
"12,""Y Liu, T Rosburg, C Gao, C Weber, C Guo"",""Differentiation of subsequent memory effects between retrieval practice and elaborative study"",2017,""Biological psychology"",""Elsevier"",""https://www.sciencedirect.com/science/article/pii/S0301051117301084"",""https://scholar.google.com/scholar?cites=9877148303201323636&as_sdt=2005&sciodt=0,5&hl=en"",192,""2020-03-10 08:38:30"","""","""","""","""",,,,,12,4.00,2,5,3,""Retrieval practice enhances memory retention more than re-studying. The underlying mechanisms of this retrieval practice effect have remained widely unclear. According to the elaborative retrieval hypothesis, activation of elaborative information occurs to a larger …"""
"13,""M Minear, JH Coane, SC Boland…"",""The benefits of retrieval practice depend on item difficulty and intelligence."",2018,""Journal of …"",""psycnet.apa.org"",""https://psycnet.apa.org/record/2018-14898-001"",""https://scholar.google.com/scholar?cites=9357187897975366501&as_sdt=2005&sciodt=0,5&hl=en"",193,""2020-03-10 08:38:30"","""","""","""","""",,,,,13,6.50,3,4,2,""The authors examined whether individual differences in fluid intelligence (gF) modulate the testing effect. Participants studied Swahili–English word pairs and repeatedly studied half the pairs or attempted retrieval, with feedback, for the remaining half. Word pairs were easy …"""
"13,""R Rummer, J Schweppe, K Gerst…"",""Is testing a more effective learning strategy than note-taking?"",2017,""Journal of Experimental …"",""psycnet.apa.org"",""https://psycnet.apa.org/doiLanding?doi=10.1037/xap0000134"",""https://scholar.google.com/scholar?cites=17772841097084149726&as_sdt=2005&sciodt=0,5&hl=en"",194,""2020-03-10 08:38:30"","""","""","""","""",,,,,13,4.33,3,4,3,""The testing effect is both robust and generalizable. However, most of the underlying studies compare testing to a rather ineffective control condition: massed repeated reading. This article therefore compares testing with note-taking, which has been shown to be more …"""
"11,""S Senzaki, J Hackathorn, DC Appleby…"",""Reinventing flashcards to increase student learning"",2017,""… Learning & Teaching"",""journals.sagepub.com"",""https://journals.sagepub.com/doi/abs/10.1177/1475725717719771"",""https://scholar.google.com/scholar?cites=5147160745458288963&as_sdt=2005&sciodt=0,5&hl=en"",195,""2020-03-10 08:38:30"","""","""","""","""",,,,,11,3.67,3,4,3,""Two studies examined the effectiveness of a flashcard-based study strategy, Flashcards-Plus, in an ecologically valid context. The strategy requires students to create flashcards designed to increase their ability to retain, comprehend, and apply textbook material to …"""
"11,""V Arnold, PA Collier, SA Leech…"",""INCASE: Simulating experience to accelerate expertise development by knowledge workers"",2013,""Intelligent Systems in …"",""Wiley Online Library"",""https://onlinelibrary.wiley.com/doi/abs/10.1002/isaf.1337"",""https://scholar.google.com/scholar?cites=6020599464138830525&as_sdt=2005&sciodt=0,5&hl=en"",196,""2020-03-10 08:38:30"","""","""","""","""",,,,,11,1.57,3,4,7,""SUMMARY INCASE, a web‐based electronic learning (e‐learning) environment, has been built to enable rapid expertise development in novice‐level professional knowledge workers. This paper describes the theoretical underpinnings (constructivist epistemology) …"""
"11,""X Pu, CS Tse"",""The influence of intentional versus incidental retrieval practices on the role of recollection in test-enhanced learning"",2014,""Cognitive processing"",""Springer"",""https://link.springer.com/article/10.1007/s10339-013-0580-2"",""https://scholar.google.com/scholar?cites=9567725706073201901&as_sdt=2005&sciodt=0,5&hl=en"",197,""2020-03-10 08:38:30"","""","""","""","""",,,,,11,1.83,6,2,6,""A testing effect occurs when taking a test leads to more durable memory for tested materials, relative to restudying them during the same period of time. In the current study, we examined whether incidental and intentional restudy/testing practice modes during a practice phase …"""
"11,""PR Aldrich"",""The curriculum prerequisite network: Modeling the curriculum as a complex system"",2015,""Biochemistry and Molecular Biology Education"",""Wiley Online Library"",""https://iubmb.onlinelibrary.wiley.com/doi/abs/10.1002/bmb.20861"",""https://scholar.google.com/scholar?cites=15372770213224465268&as_sdt=2005&sciodt=0,5&hl=en"",198,""2020-03-10 08:38:30"","""","""","""","""",,,,,11,2.20,11,1,5,""This article advances the prerequisite network as a means to visualize the hidden structure in an academic curriculum. Networks have been used to represent a variety of complex systems ranging from social systems to biochemical pathways and protein interactions …"""
"11,""SJ Ritchie, S Della Sala, RD McIntosh"",""Retrieval practice, with or without mind mapping, boosts fact learning in primary school children"",2013,""PloS one"",""ncbi.nlm.nih.gov"",""https://www.ncbi.nlm.nih.gov/pmc/articles/PMC3827082/"",""https://scholar.google.com/scholar?cites=4478953324826399984&as_sdt=2005&sciodt=0,5&hl=en"",199,""2020-03-10 08:38:30"",""HTML"","""","""","""",,,,,11,1.57,4,3,7,""Retrieval practice is a method of study in which testing is incorporated into the learning process. This method is known to facilitate recall for facts in adults and in secondary-school-age children, but existing studies in younger children are somewhat limited in their practical …"""
"12,""HL Roediger III, JD Karpicke"",""Reflections on the resurgence of interest in the testing effect"",2018,""… on Psychological Science"",""journals.sagepub.com"",""https://journals.sagepub.com/doi/abs/10.1177/1745691617718873"",""https://scholar.google.com/scholar?cites=3843252823129889063&as_sdt=2005&sciodt=0,5&hl=en"",200,""2020-03-10 08:38:30"","""","""","""","""",,,,,12,6.00,6,2,2,""We discuss the findings from our 2006 article in Psychological Science on the testing effect and describe how the project arose. The testing effect (or retrieval-practice effect) was first reported in the experimental literature about a century before our article was published, and …"""
"11,""Y Zhang, X Zhou"",""Building knowledge structures by testing helps children with mathematical learning difficulty"",2016,""Journal of learning disabilities"",""journals.sagepub.com"",""https://journals.sagepub.com/doi/abs/10.1177/0022219414538515"",""https://scholar.google.com/scholar?cites=100986284577654306&as_sdt=2005&sciodt=0,5&hl=en"",201,""2020-03-10 08:38:30"","""","""","""","""",,,,,11,2.75,6,2,4,""Mathematical learning difficulty (MLD) is prevalent in the development of mathematical abilities. Previous interventions for children with MLD have focused on number sense or basic mathematical skills. This study investigated whether mathematical performance of fifth …"""
"10,""A Zhou, X Ma, J Li, D Cui"",""The advantage effect of retrieval practice on memory retention and transfer: Based on explanation of cognitive load theory"",2013,""Acta Psychologica Sinica"",""journal.psych.ac.cn"",""http://journal.psych.ac.cn/xlxb/EN/abstract/abstract3548.shtml"",""https://scholar.google.com/scholar?cites=11237746961230218097&as_sdt=2005&sciodt=0,5&hl=en"",202,""2020-03-10 08:38:30"","""","""","""","""",,,,,10,1.43,3,4,7,""A wealth of researches has indicated that retrieval practice can be used as an effective means to improve memory. Recently the effects of retrieval practice have captured the attention of contemporary researchers who are interested in educational applications of …"""
"10,""ML Lê"",""The use of anonymous pop-quizzes (APQs) as a tool to reinforce learning"",2012,""Journal of the Medical Library Association: JMLA"",""ncbi.nlm.nih.gov"",""https://www.ncbi.nlm.nih.gov/pmc/articles/PMC3484958/"",""https://scholar.google.com/scholar?cites=18270700195271200704&as_sdt=2005&sciodt=0,5&hl=en"",203,""2020-03-10 08:38:30"",""HTML"","""","""","""",,,,,10,1.25,10,1,8,""This paper reports on the use of anonymous pop quizzes (APQs) during stand-alone and multi-session library instruction sessions. APQs were used at the end of a class as a tool to test how well students have understood the material presented to them, to reinforce retention …"""
"10,""AL Overoye, BC Storm"",""Harnessing the power of uncertainty to enhance learning."",2015,""Translational Issues in Psychological …"",""psycnet.apa.org"",""https://psycnet.apa.org/doiLanding?doi=10.1037/tps0000022"",""https://scholar.google.com/scholar?cites=10571799369249426138&as_sdt=2005&sciodt=0,5&hl=en"",204,""2020-03-10 08:38:30"","""","""","""","""",,,,,10,2.00,5,2,5,""Uncertainty is generally considered antithetical to the goals of education. Students and teachers aim to make learning quick, easy, and free from confusion. As we argue here, however, when used effectively, uncertainty has the power to create conditions of learning …"""
"10,""KH Chiang, CY Fan, HH Liu, GD Chen"",""Effects of a computer-assisted argument map learning strategy on sixth-grade students' argumentative essay reading comprehension"",2016,""Multimedia Tools and …"",""Springer"",""https://link.springer.com/article/10.1007/s11042-015-2904-y"",""https://scholar.google.com/scholar?cites=14800947313719488017&as_sdt=2005&sciodt=0,5&hl=en"",205,""2020-03-10 08:38:30"","""","""","""","""",,,,,10,2.50,3,4,4,""Numerous studies have proved that graphic strategies, such as graphic organization and concept mapping, can facilitate improving reading comprehension. However, the question as to what graphic strategies can improve argumentative essay reading comprehension …"""
"10,""R Churches, E Dommett, I Devonshire"",""Neuroscience for teachers: Applying research evidence from brain science"",2017,"""",""books.google.com"",""https://books.google.com/books?hl=en&lr=&id=Ft8zDwAAQBAJ&oi=fnd&pg=PT32&ots=rZ8NEov7GU&sig=qpUHHNqg5AdM--LkbMGlKKPg_iM"",""https://scholar.google.com/scholar?cites=17300328988249787963&as_sdt=2005&sciodt=0,5&hl=en"",206,""2020-03-10 08:38:30"",""BOOK"","""","""","""",,,,,10,3.33,3,3,3,""Foreword by Baroness Susan Greenfield CBE. In Neuroscience for Teachers: Applying Research Evidence from Brain Science, Richard Churches, Eleanor Dommett and Ian Devonshire expertly unpack, in an easy-to-read and instantly useable way, what every …"""
"10,""J Rencic, SJ Durning, E Holmboe…"",""Understanding the assessment of clinical reasoning"",2016,""Assessing competence in …"",""Springer"",""https://link.springer.com/chapter/10.1007/978-3-319-30064-1_11"",""https://scholar.google.com/scholar?cites=13742537711328898731&as_sdt=2005&sciodt=0,5&hl=en"",207,""2020-03-10 08:38:30"","""","""","""","""",,,,,10,2.50,3,4,4,""Clinical reasoning assessment is an essential component of determining a health professional's competence. Clinical reasoning cannot be assessed directly. It must be gleaned from a health professional's choices and decisions. Clinical knowledge and …"""
"10,""J Williams"",""Applying cognitive science to online learning"",2013,""Available at SSRN 2535549"",""papers.ssrn.com"",""https://papers.ssrn.com/sol3/papers.cfm?abstract_id=2535549"",""https://scholar.google.com/scholar?cites=2755485346682807183&as_sdt=2005&sciodt=0,5&hl=en"",208,""2020-03-10 08:38:30"","""","""","""","""",,,,,10,1.43,10,1,7,""Online educational resources like videos and exercises are playing an increasing role in the education of thousands of students, via both MOOCs and blended education in classrooms. Taking advantage of the progress in scientific research on learning, this paper considers …"""
"10,""JA LaPaglia, JCK Chan"",""Retrieval does not always enhance suggestibility: Testing can improve witness identification performance."",2012,""Law and Human Behavior"",""psycnet.apa.org"",""https://psycnet.apa.org/getdoi.cfm?doi=10.1037/h0093931"",""https://scholar.google.com/scholar?cites=15524960379505943416&as_sdt=2005&sciodt=0,5&hl=en"",209,""2020-03-10 08:38:30"","""","""","""","""",,,,,10,1.25,5,2,8,""Verbally recalling the appearance of a perpetrator and the details of an event can sometimes hinder later eyewitness memory performance. In two experiments, we investigated the effects of verbally recalling a face on people's ability to resist subsequent …"""
"9,""JD Proctor, J Bernstein"",""Environmental connections and concept mapping: implementing a new learning technology at Lewis & Clark College"",2013,""Journal of Environmental Studies and Sciences"",""Springer"",""https://link.springer.com/article/10.1007/s13412-013-0109-0"",""https://scholar.google.com/scholar?cites=13304146961352103372&as_sdt=2005&sciodt=0,5&hl=en"",210,""2020-03-10 08:38:30"","""","""","""","""",,,,,9,1.29,5,2,7,""What is environment? The answer to this question is fundamental to how we teach environmental studies and sciences (ESS). We follow recent scholarly literature in approaching environment as connection, not as some category of reality, and consider …"""
"9,""C Rovira"",""Theoretical foundation and literature review of the study of concept maps using eye tracking methodology"",2016,""El profesional de la información. 2016; 25 (1): 59-73"",""repositori.upf.edu"",""https://repositori.upf.edu/handle/10230/27124"",""https://scholar.google.com/scholar?cites=8349827590729354203&as_sdt=2005&sciodt=0,5&hl=en"",211,""2020-03-10 08:38:30"","""","""","""","""",,,,,9,2.25,9,1,4,""In this paper, we will be carrying out an in-depth analysis of a series of investigations involving concept maps used in eye/ntracking methodology. First, the background to this kind of research is analyzed: on the one hand we will focus on generic/nscientific literature …"""
"9,""MC Linn, J Chiu"",""Combining Learning and Assessment to Improve Science Education."",2011,""Research & Practice in Assessment"",""ERIC"",""https://eric.ed.gov/?id=EJ1062825"",""https://scholar.google.com/scholar?cites=1172181978384223349&as_sdt=2005&sciodt=0,5&hl=en"",212,""2020-03-10 08:38:30"","""","""","""","""",,,,,9,1.00,5,2,9,""High-stakes tests take time away from valuable learning activities, narrow the focus of instruction, and imply that science involves memorizing details rather than understanding the natural world. Current tests lead precollege instructors to postpone science inquiry …"""
"11,""R Lieu, A Wong, A Asefirad…"",""Improving exam performance in introductory biology through the use of preclass reading guides"",2017,""CBE—Life Sciences …"",""Am Soc Cell Biol"",""https://www.lifescied.org/doi/abs/10.1187/cbe.16-11-0320"",""https://scholar.google.com/scholar?cites=7359110917546746900&as_sdt=2005&sciodt=0,5&hl=en"",213,""2020-03-10 08:38:30"","""","""","""","""",,,,,11,3.67,3,4,3,""High-structure courses or flipped courses require students to obtain course content before class so that class time can be used for active-learning exercises. While textbooks are used ubiquitously in college biology courses for content dissemination, studies have shown that …"""
"9,""JL Dobson, T Linderholm…"",""Self-testing produces superior recall of both familiar and unfamiliar muscle information"",2015,""Advances in physiology …"",""physiology.org"",""https://www.physiology.org/doi/abs/10.1152/advan.00052.2015"",""https://scholar.google.com/scholar?cites=10450171076564603535&as_sdt=2005&sciodt=0,5&hl=en"",214,""2020-03-10 08:38:30"","""","""","""","""",,,,,9,1.80,3,3,5,""Dozens of studies have found learning strategies based on the “testing effect” promote greater recall than those that rely solely on reading; however, the advantages of testing are often only observed after a delay (eg, 2–7 days later). In contrast, our research, which has …"""
"8,""M Saletta, L Goffman, C Ward, J Oleson"",""Influence of language load on speech motor skill in children with specific language impairment"",2018,""Journal of Speech, Language, and …"",""ASHA"",""https://pubs.asha.org/doi/abs/10.1044/2017_JSLHR-L-17-0066"",""https://scholar.google.com/scholar?cites=1272015330936396878&as_sdt=2005&sciodt=0,5&hl=en"",215,""2020-03-10 08:38:30"","""","""","""","""",,,,,8,4.00,2,4,2,""Purpose Children with specific language impairment (SLI) show particular deficits in the generation of sequenced action: the quintessential procedural task. Practiced imitation of a sequence may become rote and require reduced procedural memory. This study explored …"""
"9,""WSY Mok, WWL Chan"",""How do tests and summary writing tasks enhance long-term retention of students with different levels of test anxiety?"",2016,""Instructional Science"",""Springer"",""https://link.springer.com/article/10.1007/s11251-016-9393-x"",""https://scholar.google.com/scholar?cites=9180614921415363350&as_sdt=2005&sciodt=0,5&hl=en"",216,""2020-03-10 08:38:30"","""","""","""","""",,,,,9,2.25,5,2,4,""Testing has been found to facilitate students' long-term retention of information. However, the learning performance of highly test-anxious students can be impaired by tests. Thus, these students may learn ineffectively in a testing context. By contrast, summary writing may …"""
"8,""T Tempel, C Frings"",""How motor practice shapes memory: Retrieval but not extra study can cause forgetting"",2016,""Memory"",""Taylor & Francis"",""https://www.tandfonline.com/doi/abs/10.1080/09658211.2015.1059858"",""https://scholar.google.com/scholar?cites=12621634246450684824&as_sdt=2005&sciodt=0,5&hl=en"",217,""2020-03-10 08:38:30"","""","""","""","""",,,,,8,2.00,4,2,4,""We investigated the retrieval specificity of retrieval-induced forgetting (RIF) of motor sequences. In two experiments, participants learned sequential finger movements, each consisting of the movement of two fingers of either the left or the right hand. In the learning …"""
"8,""P Howard-Jones, K Ioannou, R Bailey, J Prior…"",""Applying the science of learning in the classroom"",2018,""…"",""impact.chartered.college"",""https://impact.chartered.college/article/howard-jones-applying-science-learning-classroom/"",""https://scholar.google.com/scholar?cites=2643248590230723674&as_sdt=2005&sciodt=0,5&hl=en"",218,""2020-03-10 08:38:30"",""HTML"","""","""","""",,,,,8,4.00,2,5,2,""The US 'decade of the brain'in the 1990s saw the launch of a number of educational programmes that claimed to be 'brain-based'. These were usually unscientific in their approach and motivated by commercial interests. Rather than inform education, these …"""
"8,""MB Antonoff, J D'Cunha"",""Retrieval practice as a means of primary learning: Socrates had the right idea"",2011,""Seminars in thoracic and cardiovascular surgery"",""Elsevier"",""https://www.sciencedirect.com/science/article/pii/S1043067911000888"",""https://scholar.google.com/scholar?cites=4307828887629197762&as_sdt=2005&sciodt=0,5&hl=en"",219,""2020-03-10 08:38:30"","""","""","""","""",,,,,8,0.89,4,2,9,""In a recent publication, investigators examined the ways in which learners most effectively acquired new knowledge. The authors found that students achieved the most meaningful and long-lasting learning through retrieval practice, a method consisting of taking tests on …"""
"8,""S Ye, G Fellouris, S Culpepper…"",""Sequential detection of learning in cognitive diagnosis"",2016,""British Journal of …"",""Wiley Online Library"",""https://onlinelibrary.wiley.com/doi/abs/10.1111/bmsp.12065"",""https://scholar.google.com/scholar?cites=17362046817694145313&as_sdt=2005&sciodt=0,5&hl=en"",220,""2020-03-10 08:38:30"","""","""","""","""",,,,,8,2.00,2,4,4,""In order to look more closely at the many particular skills examinees utilize to answer items, cognitive diagnosis models have received much attention, and perhaps are preferable to item response models that ordinarily involve just one or a few broadly defined skills, when …"""
"7,""M Abel, HL Roediger III"",""The testing effect in a social setting: Does retrieval practice benefit a listener?"",2018,""Journal of experimental psychology …"",""psycnet.apa.org"",""https://psycnet.apa.org/buy/2017-52846-001"",""https://scholar.google.com/scholar?cites=17723149630389345035&as_sdt=2005&sciodt=0,5&hl=en"",221,""2020-03-10 08:38:30"","""","""","""","""",,,,,7,3.50,4,2,2,""Retrieval practice boosts retention relative to other study strategies like restudying, a finding known as the testing effect. In 3 experiments, the authors investigated testing in social contexts. Subjects participated in pairs and engaged in restudy and retrieval practice of …"""
"8,""T Kurtz, J Mogle, MJ Sliwinski…"",""Individual differences in task-specific paired associates learning in older adults: the role of processing speed and working memory"",2013,""Experimental aging …"",""Taylor & Francis"",""https://www.tandfonline.com/doi/abs/10.1080/0361073X.2013.839024"",""https://scholar.google.com/scholar?cites=1587600709568231423&as_sdt=2005&sciodt=0,5&hl=en"",222,""2020-03-10 08:38:30"","""","""","""","""",,,,,8,1.14,2,4,7,""Background/Study Context: The role of processing speed and working memory was investigated in terms of individual differences in task-specific paired associates learning in a sample of older adults. Task-specific learning, as distinct from content-oriented item-specific …"""
