"Cites,Authors,Title,Year,Source,Publisher,ArticleURL,CitesURL,GSRank,QueryDate,Type,DOI,ISSN,CitationURL,Volume,Issue,StartPage,EndPage,ECC,CitesPerYear,CitesPerAuthor,AuthorCount,Age,Abstract"
"2,""KM Roessger"",""Investigating the impact of formal reflective activities on skill adaptation in a work-related instrumental learning setting"",2013,"""",""dc.uwm.edu"",""http://dc.uwm.edu/cgi/viewcontent.cgi?article=1310&context=etd"",""https://scholar.google.com/scholar?cites=4893810589508903374&as_sdt=2005&sciodt=0,5&hl=en"",370,""2020-03-10 08:38:30"",""PDF"","""","""","""",,,,,2,0.29,2,1,7,""In work-related, instrumental learning contexts the role of reflective activities is unclear. Kolb's (1985) experiential learning theory and Mezirow's transformative learning theory (2000) predict skill-adaptation as a possible outcome. This prediction was experimentally …"""
"2,""C Camp, V Antenucci, J Brush, T Slominski"",""Using spaced retrieval to effectively treat dysphagia in clients with dementia"",2012,""Perspectives on Swallowing …"",""ASHA"",""https://pubs.asha.org/doi/abs/10.1044/sasd21.3.96"",""https://scholar.google.com/scholar?cites=6634229929042823508&as_sdt=2005&sciodt=0,5&hl=en"",371,""2020-03-10 08:38:30"","""","""","""","""",,,,,2,0.25,1,4,8,""Spaced retrieval (SR) is an evidence-based memory intervention that can be effective for helping people with mild to moderate dementia. It can be used to help clients reach a variety of goals, such as less repetitive questioning, better orientation, greater engagement in …"""
"2,""D Meehan, M Sabin"",""QuizPower: a mobile app with app inventor and XAMPP service integration"",2013,""Proceedings of the 14th annual ACM SIGITE …"",""dl.acm.org"",""https://dl.acm.org/doi/abs/10.1145/2512276.2512300"",""https://scholar.google.com/scholar?cites=15226017571901413568&as_sdt=2005&sciodt=0,5&hl=en"",372,""2020-03-10 08:38:30"","""","""","""","""",,,,,2,0.29,1,2,7,""This paper details the development of a mobile app for the Android operating system using MIT App Inventor language and development platform. The app, Quiz Power, provides students a way to study course material in an engaging and effective manner. At its current …"""
"2,""KA Gibson-Dee"",""Hope, expectation, math anxiety, and achievement in college algebra students: Examining an instructional strategy using multi-level modeling"",2016,"""",""scholarcommons.usf.edu"",""https://scholarcommons.usf.edu/etd/6506/"",""https://scholar.google.com/scholar?cites=2613090300347447472&as_sdt=2005&sciodt=0,5&hl=en"",373,""2020-03-10 08:38:30"","""","""","""","""",,,,,2,0.50,2,1,4,""American students no longer lead the world in quantitative skills. This decline in mathematical ability has potentially significant negative national and personal consequences. Math anxiety, low self-efficacy in relation to math, and a sense of …"""
"2,""B Fleck, AS Richmond, HM Rauer…"",""Active reading questions as a strategy to support college students' textbook reading."",2017,""… of Teaching and …"",""psycnet.apa.org"",""https://psycnet.apa.org/buy/2017-41169-003"",""https://scholar.google.com/scholar?cites=11072955527347145400&as_sdt=2005&sciodt=0,5&hl=en"",374,""2020-03-10 08:38:30"","""","""","""","""",,,,,2,0.67,1,4,3,""This pilot study and experiment investigates the use of active reading questions (ARQs) as a potential reading tool to support college students' textbook reading. The pilot study compares the self-selected use of ARQs and PowerPoint slides (PPTs) in 4 college …"""
"2,""TJ Lindenmaier, J Brown, L Ranieri…"",""The effect of an e-learning module on health sciences students' venipuncture skill development"",2018,""Canadian journal of …"",""ncbi.nlm.nih.gov"",""https://www.ncbi.nlm.nih.gov/pmc/articles/PMC5882240/"",""https://scholar.google.com/scholar?cites=7300974940259622069&as_sdt=2005&sciodt=0,5&hl=en"",375,""2020-03-10 08:38:30"",""HTML"","""","""","""",,,,,2,1.00,1,4,2,""Methods Overall, 224 health sciences students were approached to participate in this pilot study. Recruited students were divided into control and study groups. The control group received only in-class training, whereas the study group had access to the e-learning …"""
"3,""J Roelle, M Nückles"",""Generative learning versus retrieval practice in learning from text: The cohesion and elaboration of the text matters."",2019,""Journal of Educational Psychology"",""psycnet.apa.org"",""https://psycnet.apa.org/doiLanding?doi=10.1037%2Fedu0000345"",""https://scholar.google.com/scholar?cites=13231972971063674082&as_sdt=2005&sciodt=0,5&hl=en"",376,""2020-03-10 08:38:30"","""","""","""","""",,,,,3,3.00,2,2,1,""Both generative learning tasks and retrieval practice tasks can serve as a beneficial follow-up to an initial study phase in which learners have studied new learning material. However, research that compares the effects of these 2 types of learning tasks is scarce. Therefore, it is …"""
"3,""E Tshibwabwa, R Mallin, M Fraser…"",""An Integrated Interactive-Spaced Education Radiology Curriculum for Preclinical Students"",2017,""Journal of clinical …"",""ncbi.nlm.nih.gov"",""https://www.ncbi.nlm.nih.gov/pmc/articles/PMC5450459/"",""https://scholar.google.com/scholar?cites=14625399630514087407&as_sdt=2005&sciodt=0,5&hl=en"",377,""2020-03-10 08:38:30"",""HTML"","""","""","""",,,,,3,1.00,1,4,3,""Materials and Methods: Second-year students at the American University of Antigua College of Medicine participated in small groups of ten students each into two 2 h of radiology laboratories. The study comprised two cohorts: winter and fall 2013 students (control group) …"""
"3,""RM Nosofsky, MA McDaniel"",""Recommendations from cognitive psychology for enhancing the teaching of natural-science categories"",2019,""Policy Insights from the …"",""journals.sagepub.com"",""https://journals.sagepub.com/doi/abs/10.1177/2372732218814861"",""https://scholar.google.com/scholar?cites=17316260950046856917&as_sdt=2005&sciodt=0,5&hl=en"",378,""2020-03-10 08:38:30"","""","""","""","""",,,,,3,3.00,2,2,1,""Because of their complex structures, many natural-science categories are difficult to learn. Yet achieving accuracy in classification is crucial to scientific inference and reasoning. Thus, an emerging theme in cognitive-psychology and cognitive-science research has been to …"""
"2,""MD Bush"",""Educational technology points of inflection: Fads and prejudices hide potential points of inflection"",2015,""Educational technology: The magazine for managers …"",""dialnet.unirioja.es"",""https://dialnet.unirioja.es/servlet/articulo?codigo=6452545"",""https://scholar.google.com/scholar?cites=14531228474101046122&as_sdt=2005&sciodt=0,5&hl=en"",379,""2020-03-10 08:38:30"",""CITATION"","""","""","""",,,,,2,0.40,2,1,5,""Localización: Educational technology: The magazine for managers of change in education, ISSN 0013-1962, Vol. 55, Nº. 4, 2015 (Ejemplar dedicado a: A general issue covering varied aspects of educational technology), págs. 60-63"""
"2,""M Ramscar, M Dye, S McCauley"",""Expectation and error distribution in language learning: The curious absence of “mouses” in adult speech"",2012,""Language"",""academia.edu"",""https://www.academia.edu/download/29455809/Ramscar_mouses.pdf"",""https://scholar.google.com/scholar?cites=15548583244521797723&as_sdt=2005&sciodt=0,5&hl=en"",380,""2020-03-10 08:38:30"",""PDF"","""","""","""",,,,,2,0.25,1,3,8,""As children learn their mother tongues, they make systematic errors. For example, Englishspeaking children regularly say “mouses” rather than “mice.” Because children's errors aren't explicitly corrected, it has been argued that children could never learn to make …"""
"2,""C Wiklund-Hörnqvist"",""Brain-based Teaching: Behavioral and neuro-cognitive evidence for the power of test-enhanced learning"",2014,"""",""diva-portal.org"",""http://www.diva-portal.org/smash/record.jsf?pid=diva2:764456"",""https://scholar.google.com/scholar?cites=4568195015253517827&as_sdt=2005&sciodt=0,5&hl=en"",381,""2020-03-10 08:38:30"",""HTML"","""","""","""",,,,,2,0.33,2,1,6,""One topic that is currently of wide interest in Sweden, as well as globally, is the identification of effective ways to achieve supportive learning, in school contexts and elsewhere, but this has proven to be a challenging task. Central to the educational context is the acquisition of …"""
"2,""CA Rowland"",""Testing effects in context memory"",2011,"""",""mountainscholar.org"",""https://mountainscholar.org/handle/10217/46908"",""https://scholar.google.com/scholar?cites=18386546992159032380&as_sdt=2005&sciodt=0,5&hl=en"",382,""2020-03-10 08:38:30"","""","""","""","""",,,,,2,0.22,2,1,9,""Retrieving a previously learned piece of information can have profound positive effects on the later retention of such information. However, it is not clear if test-induced memory benefits are restricted to the specific information which was retrieved, or if they can …"""
"2,""Z Wang, D McDougall"",""Curriculum Matters: What We Teach and What Students Gain"",2019,""International Journal of Science and Mathematics …"",""Springer"",""https://link.springer.com/article/10.1007/s10763-018-9915-x"",""https://scholar.google.com/scholar?cites=5284787180274773768&as_sdt=2005&sciodt=0,5&hl=en"",383,""2020-03-10 08:38:30"","""","""","""","""",,,,,2,2.00,1,2,1,""This study examined and compared the intended mathematics curricula according to topic coverage, focus, coherence, and learning progression in grades 1–12 within China and the province of Ontario, Canada. The findings show that the overall topics in the two curricula …"""
"2,""PD Antonenko"",""Educational neuroscience: Exploring cognitive processes that underlie learning"",2019,""Mind, brain and technology"",""Springer"",""https://link.springer.com/chapter/10.1007/978-3-030-02631-8_3"",""https://scholar.google.com/scholar?cites=1198393752955656991&as_sdt=2005&sciodt=0,5&hl=en"",384,""2020-03-10 08:38:30"","""","""","""","""",,,,,2,2.00,2,1,1,""This chapter reviews the most important neurotechnologies, neuroscience approaches, and empirical research using neuroscience methods and tools in education. Four specific technologies and representative studies using them are discussed in detail: eye tracking …"""
"2,""J Mokry"",""Recalling prerequisite material in a calculus II course to improve student success"",2016,""PRIMUS"",""Taylor & Francis"",""https://www.tandfonline.com/doi/abs/10.1080/10511970.2015.1104766"",""https://scholar.google.com/scholar?cites=2548489054342910555&as_sdt=2005&sciodt=0,5&hl=en"",385,""2020-03-10 08:38:30"","""","""","""","""",,,,,2,0.50,2,1,4,""This article discusses preparation assignments used in a Calculus II course that cover material from prerequisite courses. Prior to learning new material, students work on problems outside of class involving concepts from algebra, trigonometry, and Calculus I …"""
"2,""LC Parker, AM Gleichsner…"",""Targeting change: Assessing a faculty learning community focused on increasing statistics content in life science curricula"",2016,""Biochemistry and …"",""Wiley Online Library"",""https://iubmb.onlinelibrary.wiley.com/doi/abs/10.1002/bmb.20974"",""https://scholar.google.com/scholar?cites=4974144209330512505&as_sdt=2005&sciodt=0,5&hl=en"",386,""2020-03-10 08:38:30"","""","""","""","""",,,,,2,0.50,1,3,4,""Transformation of research in all biological fields necessitates the design, analysis and, interpretation of large data sets. Preparing students with the requisite skills in experimental design, statistical analysis, and interpretation, and mathematical reasoning will require both …"""
"2,""K Okano, JR Kaczmarzyk, JDE Gabrieli"",""Enhancing workplace digital learning by use of the science of learning"",2018,""PloS one"",""ncbi.nlm.nih.gov"",""https://www.ncbi.nlm.nih.gov/pmc/articles/PMC6200252/"",""https://scholar.google.com/scholar?cites=3486526675175919345&as_sdt=2005&sciodt=0,5&hl=en"",387,""2020-03-10 08:38:30"",""HTML"","""","""","""",,,,,2,1.00,1,3,2,""Digital learning is becoming the most commonly used portal for workplace learning, but its effectiveness is not clearly understood. We studied 99 employees on-site in a large company as they watched an already used and required training video. Employees were …"""
"5,""BFT Moreira, TSS Pinto, DSV Starling…"",""Retrieval practice in classroom settings: a review of applied research"",2019,""Frontiers in …"",""pdfs.semanticscholar.org"",""https://pdfs.semanticscholar.org/4af3/443bf06ddaddf56fe63acbb06e46f6b810ba.pdf"",""https://scholar.google.com/scholar?cites=3016349686158411853&as_sdt=2005&sciodt=0,5&hl=en"",388,""2020-03-10 08:38:30"",""PDF"","""","""","""",,,,,5,5.00,1,4,1,""Tests have been vastly used for the assessment of learning in educational contexts. Recently, however, a growing body of research has shown that the practice of remembering previously studied information (ie, retrieval practice) is more advantageous for long-term …"""
"2,""TD Griffin, J Wiley, KW Thiede"",""The effects of comprehension-test expectancies on metacomprehension accuracy."",2018,""Journal of Experimental …"",""psycnet.apa.org"",""https://psycnet.apa.org/record/2018-35588-001"",""https://scholar.google.com/scholar?cites=2616310719957626747&as_sdt=2005&sciodt=0,5&hl=en"",389,""2020-03-10 08:38:30"","""","""","""","""",,,,,2,1.00,1,3,2,""A set of four experiments assessed the effects of establishing a comprehension-test expectancy (in contrast to a memory-test expectancy) on relative metacomprehension accuracy. Typically readers show poor relative metacomprehension accuracy while learning …"""
"2,""L Renoult, MD Rugg"",""An historical perspective on Endel Tulving's episodic-semantic distinction"",2020,""Neuropsychologia"",""Elsevier"",""https://www.sciencedirect.com/science/article/pii/S0028393220300373"",""https://scholar.google.com/scholar?cites=15931511757898729978&as_sdt=2005&sciodt=0,5&hl=en"",390,""2020-03-10 08:38:30"","""","""","""","""",,,,,2,2.00,1,2,1,""The distinction between episodic and semantic memory, proposed by Endel Tulving in 1972, remains a key concept in contemporary Cognitive Neuroscience. Here we review how this distinction evolved in Tulving's writings over the years. Crucially, from 1972 onward, he …"""
"3,""李靖, 蔡可迎, 堵锡华"",""卡皮克重复提取理论在元素化学教学中的教学实践"",2014,""教育教学论坛"",""cnki.com.cn"",""http://www.cnki.com.cn/Article/CJFDTotal-JYJU201444074.htm"",""https://scholar.google.com/scholar?cites=16859622833265333763&as_sdt=2005&sciodt=0,5&hl=en"",391,""2020-03-10 08:38:30"","""","""","""","""",,,,,3,0.50,1,3,6,""针对元素化学的教学内容"""" 散"""","""" 杂"""","""" 多"""", 叙述性强的特点, 以及我院学生学习的主动性差, 兴趣低, 元素化学的课堂教学质量不理想等现状. 我们将卡皮克重复提取理论用于元素化学的教学实践. 实践结果表明该理论在元素化学教学中具有可实践性."""
"5,""강이철"",""시험치기 학습전략의 이론적 근거와 활용 실태"",2017,""사고개발"",""dbpia.co.kr"",""http://www.dbpia.co.kr/Journal/articleDetail?nodeId=NODE07398436"",""https://scholar.google.com/scholar?cites=3772318722369856434&as_sdt=2005&sciodt=0,5&hl=en"",392,""2020-03-10 08:38:30"","""","""","""","""",,,,,5,1.67,5,1,3,""이 연구의 목적은 시험치기 학습전략이 다른 학습전략에 비해 왜 더 효과적인지에 대한 이론적 근거를 분석하고 그 활용실태를 확인하는데 있다. 많은 선행연구에 따르면, 학생들은 시험치기 학습전략보다 효과가 낮은 학습전략들을 훨씬 빈번하게 사용하고 있다. 뿐만 아니라, 시험치기 …"""
"3,""余清萍"",""传统教学模式与游戏教学模式对小学英语词汇学习影响的比较研究"",2017,""现代中小学教育"",""airitilibrary.com"",""https://www.airitilibrary.com/Publication/alDetailedMesh?docid=xdzxxjy201702009"",""https://scholar.google.com/scholar?cites=3541082433691013774&as_sdt=2005&sciodt=0,5&hl=en"",393,""2020-03-10 08:38:30"","""","""","""","""",,,,,3,1.00,3,1,3,""本文以小学三年级学生为例, 基于实证研究, 对比分析传统教学模式和游戏教学模式在词汇接受和产出两个维度上对小学英语词汇学习的影响. 研究发现: 就接受性词汇学习和说的产出性词汇学习而言, 游戏教学模式在课堂学习效果上略优于传统教学模式, 在习得保持上显著优于传统 …"""
"3,""张锦坤, 连榕"",""有效学习的三个易控变量: 间隔, 顺序与提取练习"",2013,""心理与行为研究"",""cnki.com.cn"",""http://www.cnki.com.cn/Article/CJFDTotal-CLXW201302024.htm"",""https://scholar.google.com/scholar?cites=4246323159400540605&as_sdt=2005&sciodt=0,5&hl=en"",394,""2020-03-10 08:38:30"","""","""","""","""",,,,,3,0.43,2,2,7,""近年来认知科学领域关于学习问题的研究颇为关注重新探索如何在教育实践中帮助学生找到可操控性强的有效学习策略, 真正实现有效学习. 三项经典研究的进展体现了这一研究趋势: 一是学习时间间隔的动态分配, 相比较于传统的学习时段分配, 适当扩大各学习时段的时间间隔 …"""
"3,""최효식, 권희경, 민지연, 최지영"",""사전인출이 지연기억에 미치는 영향"",2014,""교육심리연구"",""dbpia.co.kr"",""http://www.dbpia.co.kr/Journal/articleDetail?nodeId=NODE06763978"",""https://scholar.google.com/scholar?cites=13437711461185415152&as_sdt=2005&sciodt=0,5&hl=en"",395,""2020-03-10 08:38:30"","""","""","""","""",,,,,3,0.50,1,4,6,""본 연구의 목적은 학습 전에 사전인출을 경험하는 것이 지연기억을 촉진하는지를 확인하고, 사전인출의 효과가 인출을 시도한 학습 내용에 대한``주의집중``때문인지 아니면``인출``경험으로 인한 관련 정보의 정교화 때문인지를 검증하는 것이었다. 연구결과,(1) …"""
"3,""C Breitenstein"",""Lernen aus neurowissenschaftlicher Sicht: von der Assoziation zur Kognition"",2012,""Diskurs Kindheits-und Jugendforschung …"",""budrich-journals.de"",""http://budrich-journals.de/index.php/diskurs/article/view/10382"",""https://scholar.google.com/scholar?cites=1876629824146161049&as_sdt=2005&sciodt=0,5&hl=en"",396,""2020-03-10 08:38:30"","""","""","""","""",,,,,3,0.38,3,1,8,""Lernen findet über die gesamte Lebensspanne hinweg statt. Die meisten alltäglichen Lernprozesse (wie Erwerb motorischer Bewegungsabfolgen, Faktenwissen und sozialer Konventionen) erfolgen „automatisiert “und werden hier unter dem Begriff „assoziatives …"""
"4,""강이철"",""인출연습의 기억증진효과에 대한 뇌영상 증거"",2018,""사고개발"",""dbpia.co.kr"",""http://www.dbpia.co.kr/Journal/articleDetail?nodeId=NODE07593815"",""https://scholar.google.com/scholar?cites=4441713410862564476&as_sdt=2005&sciodt=0,5&hl=en"",397,""2020-03-10 08:38:30"","""","""","""","""",,,,,4,2.00,4,1,2,""이 연구의 목적은 지난 100 여년간 많은 실증연구를 통해 일관되게 입증된 인출연습활동, 즉 시험치기 학습활동의 기억증진효과에 대한 뇌영상 증거를 제시하고, 교육적 활용방안을 제안하는 것이다. 이 연구 목적을 달성하기 위해 다음의 세 가지 세부 연구문제를 설정했다 …"""
"2,""K Wach"",""MOOCs jako otwarte zasoby edukacyjne wspierające edukację dla przedsiębiorczości"",2018,""Horyzonty Wychowania"",""ceeol.com"",""https://www.ceeol.com/search/article-detail?id=776436"",""https://scholar.google.com/scholar?cites=17892979145792930309&as_sdt=2005&sciodt=0,5&hl=en"",398,""2020-03-10 08:38:30"","""","""","""","""",,,,,2,1.00,2,1,2,""RESEARCH OBJECTIVE: The aim of this article is to show the open education resources in the form of MOOC platforms as the instrument supporting entrepreneurship education. THE RESEARCH PROBLEM AND METHODS: To achieve the established goal of the article, the …"""
"2,""周正钟"",""记忆提取与音位重复对二语语块习得影响的实证研究"",2014,""解放军外国语学院学报"",""cnki.com.cn"",""http://www.cnki.com.cn/Article/CJFDTotal-JFJW201406014.htm"",""https://scholar.google.com/scholar?cites=2203652772987320491&as_sdt=2005&sciodt=0,5&hl=en"",399,""2020-03-10 08:38:30"","""","""","""","""",,,,,2,0.33,2,1,6,""本研究采用2× 2 被试间双因素实验设计, 考察了记忆提取与音位重复对二语语块习得的影响, 结果发现: 1) 记忆提取对二语语块形式和意义的短时记忆没有显著影响, 但对形式和意义具有更好的长时记忆保持效果; 2) 音位重复对二语语块形式的短时记忆和长时保持的作用没有显著影响 …"""
"2,""堀田千絵"",""学習時の反復検索による幼児の記憶保持の促進効果―語彙理解に遅れのある幼児への有効性の検討―"",2015,""特殊教育学研究"",""jstage.jst.go.jp"",""https://www.jstage.jst.go.jp/article/tokkyou/53/3/53_143/_article/-char/ja/"",""https://scholar.google.com/scholar?cites=17960439614321883025&as_sdt=2005&sciodt=0,5&hl=en"",400,""2020-03-10 08:38:30"","""","""","""","""",,,,,2,0.40,2,1,5,""抄録 本研究は, 学習時の反復検索が, 語彙理解に遅れのない幼児のみならず, 遅れのある幼児の長期保持を高めるかどうかを検討することを目的とした. 幼児 30 名 (統制群 15 名, 遅滞群 15 名) に対し, 学習材料の記銘, 反復検索/聴取, 5 分後テスト, 4 時間後テストを課した …"""
"2,""冯岩松"",""论重复提取的长期记忆保持强化效应"",2016,""西南科技大学学报 (哲学社会科学版)"",""airitilibrary.com"",""https://www.airitilibrary.com/Publication/alDetailedMesh?docid=myjjjsgdzkxxxb201601004"",""https://scholar.google.com/scholar?cites=5695822251396713644&as_sdt=2005&sciodt=0,5&hl=en"",401,""2020-03-10 08:38:30"","""","""","""","""",,,,,2,0.50,2,1,4,""Karpicke 等人的一系列记忆实验表明, 学习过程中的重复提取相对于其它学习策略对词汇和意义材料的长期记忆保持, 更具强化效应, 并能产生更持久的意义学习. 然而, 许多学习者对此缺乏应有的元认知意识. 大学英语教学中, 应该注重培养学生实施积极提取练习 …"""
"2,""FJ da Paixão, SC de Freitas Mesquita, JM Neto"",""Física para crianças: O Calendário ea Medida do Tempo: A Observação do Ano"",2011,"""",""abrapecnet.org.br"",""http://abrapecnet.org.br/atas_enpec/viiienpec/resumos/R0308-1.pdf"",""https://scholar.google.com/scholar?cites=13412796623234004053&as_sdt=2005&sciodt=0,5&hl=en"",402,""2020-03-10 08:38:30"",""PDF"","""","""","""",,,,,2,0.22,1,3,9,""Page 1. 1 FÍSICA PARA CRIANÇAS: O CALENDÁRIO E A MEDIDA DO TEMPO: A OBSERVAÇÃO DO ANO PHYSICS FOR KIDS: THE CALENDAR AND THE MEASUREMENT OF TIME. OBSERVING THE YEAR Fernando J. da Paixão Universidade Estadual de Campinas, Instituto …"""
"1,""U Guven"",""The Relationship between Testing Frequency and Student Achievement in Eighth-Grade Mathematics: An International Comparative Study Based on TIMSS 2011"",2017,"""",""dsc.duq.edu"",""https://dsc.duq.edu/etd/131/"",""https://scholar.google.com/scholar?cites=14226785641352411057&as_sdt=2005&sciodt=0,5&hl=en"",403,""2020-03-10 08:38:30"","""","""","""","""",,,,,1,0.33,1,1,3,""The purpose of this study was to examine the relationship between quiz frequency and student achievement in eighth-grade mathematics as measured by TIMSS. The more specific goal of the study was determining the best quiz frequency (daily, weekly, monthly …"""
"1,""ST Peverly, G Marcelin, M Kern"",""Interventions for students with lecture note-taking difficulties."",2014,"""",""psycnet.apa.org"",""https://psycnet.apa.org/record/2014-14418-012"",""https://scholar.google.com/scholar?cites=3241049138424488960&as_sdt=2005&sciodt=0,5&hl=en"",404,""2020-03-10 08:38:30"","""","""","""","""",,,,,1,0.17,0,3,6,""The purpose of this chapter is to review research on the predominant type of note-taking, lecture notes, for the purposes of helping educators and students improve their note-taking. Toward that end, we review research on:(a) the relative importance of the two primary …"""
"1,""MD Miller, B Scarnati"",""Engaging Faculty for Student Success: The First Year Learning Initiative"",2014,""Teacher-Scholar: The Journal of the State …"",""scholars.fhsu.edu"",""http://scholars.fhsu.edu/cgi/viewcontent.cgi?article=1027&context=ts"",""https://scholar.google.com/scholar?cites=2256361395429141144&as_sdt=2005&sciodt=0,5&hl=en"",405,""2020-03-10 08:38:30"",""PDF"","""","""","""",,,,,1,0.17,1,2,6,""State Comprehensive Universities (SCUs) face numerous challenges. In the face of radically reduced support from state legislatures, SCU students and their parents remain extremely sensitive to the costs of higher education and rising tuition rates. For SCU faculty, workloads …"""
"1,""JN Pence"",""Using computer adaptive quizzing as a tool for nclex-rn success"",2016,"""",""ir.ua.edu"",""http://ir.ua.edu/handle/123456789/2582"",""https://scholar.google.com/scholar?cites=774626763887782207&as_sdt=2005&sciodt=0,5&hl=en"",406,""2020-03-10 08:38:30"","""","""","""","""",,,,,1,0.25,1,1,4,""A common goal among nurse educators is to adequately prepare graduates to be competent, caring professionals who deliver the highest standard of care. For the nursing school graduate, the first step to attaining this goal is success on the NCLEX-RN. Nurse …"""
