Cites,Authors,Title,Year,Source,Publisher,ArticleURL,CitesURL,GSRank,QueryDate,Type,DOI,ISSN,CitationURL,Volume,Issue,StartPage,EndPage,ECC,CitesPerYear,CitesPerAuthor,AuthorCount,Age,Abstract
0,"Y Hu, A Baragchizadeh, AJ O'Toole",Integrating faces and bodies: Psychological and neural perspectives on whole person perception,2020,Neuroscience & Biobehavioral …,Elsevier,https://www.sciencedirect.com/science/article/pii/S0149763419309182,,327,3/9/20 17:32,,,,,,,,,0,0,0,3,1,The human “person” is a common percept we encounter. Research on person perception has been focused either on face or body perception—with less attention paid to whole person perception. We review psychological and neuroscience studies aimed at …
0,"CL Franco, JMB Fugate",Emoji Face Renderings: Exploring the Role Emoji Platform Differences have on Emotional Interpretation,,Journal of Nonverbal Behavior,Springer,https://link.springer.com/article/10.1007/s10919-019-00330-1,,328,3/9/20 17:32,,,,,,,,,0,0,0,2,,"Emoji faces are ubiquitous and integrated into most people's everyday (nonverbal) vernacular. Yet, we know little about how people interpret these characters in terms of their emotional content. Do people agree that an emoji face represents an individual emotion and …"
0,"WH Kim, JW Park, WH Lee, HS Lee…",LMA Descriptor for Emotional Motion Recognition,2013,… on Robotics (ISR2013),koasas.kaist.ac.kr,https://koasas.kaist.ac.kr/handle/10203/256791,,329,3/9/20 17:32,CITATION,,,,,,,,0,0,0,5,7,
0,"J Hu, B Yu, Y Yang, B Feng",Towards Facial De-Expression and Expression Recognition in the Wild,2019,2019 8th International …,ieeexplore.ieee.org,https://ieeexplore.ieee.org/abstract/document/8925461/,,330,3/9/20 17:32,,,,,,,,,0,0,0,4,1,Previous work has shown that a facial expression is able to be decomposed into an expressive component and an neutral component. Many researchers have utilized this principle to implement the facial expression classification with paired laboratory-controlled …
0,AY Kwon,Mother–Infant Emotional Communication and Infants' Development of Emotional Expressions: A Cross-Cultural Study in The United States and South Korea,2019,,search.proquest.com,http://search.proquest.com/openview/112ba909124e8741a787edb648ce43b2/1?pq-origsite=gscholar&cbl=18750&diss=y,,331,3/9/20 17:32,,,,,,,,,0,0,0,1,1,"A caregiver is the primary environment of children during their early life, and the bidirectional process of emotional communication between caregivers and infants influences infants' emotional development. When infants express their emotions within the bidirectional …"
0,VK Manduva,Simple cephalo-caudal patterns embedded in complex human interpersonal behavior,2017,,peerj.com,https://peerj.com/preprints/127.pdf,,332,3/9/20 17:32,PDF,,,,,,,,0,0,0,1,3,"A novel model is presented to explain human social behavior. In recent years, a cephalo-caudal directionality to behavior has been reported in a few mammals including rodents, cattle and cats. This model shows how complex human behavior also follows this rule of …"
0,N Strengell,Transfer Learning in Emotion Recognition,2017,,ambientintelligence.aalto.fi,http://ambientintelligence.aalto.fi/theses/Strengell_BSc.pdf,,333,3/9/20 17:32,PDF,,,,,,,,0,0,0,1,3,"Transfer Learning in Emotion Recognition Date: May 5, 2017 Pages: 49 Major:- Code:-Supervisors: University Lecturer Kalle Ruttik Advisor: Professor Stephan Sigg The purpose of this thesis is to review and discuss automated emotion recognition and transfer learning …"
0,"H Aguirre-Loaiza, J Arenas, I Arias…",Effect of acute physical exercise on executive functions and emotional recognition: Analysis of moderate to high intensity in young adults,2019,Frontiers in …,ncbi.nlm.nih.gov,https://www.ncbi.nlm.nih.gov/pmc/articles/PMC6937985/,,334,3/9/20 17:32,HTML,,,,,,,,0,0,0,4,1,"Physical exercise (PE) is associated with cognitive changes and brain function. However, it is required to clarify the effect of PE in different intensities, population groups conditions and the EF duration over different cognitive domains. Besides, no studies are known to have …"
0,"D Roth, C Bloch, AK Wilbers, K Kaspar, ME Latoschik…",Quantification of Signal Carriers for Emotion Recognition from Body Movement and Facial Affects,,researchgate.net,,https://www.researchgate.net/profile/Marc_Latoschik/publication/281366539_Quantification_of_Signal_Carriers_for_Emotion_Recognition_from_Body_Movement_and_Facial_Affects/links/55e3f3ab08ae6abe6e8e845f/Quantification-of-Signal-Carriers-for-Emotion-Recognition-from-Body-Movement-and-Facial-Affects.pdf,,335,3/9/20 17:32,PDF,,,,,,,,0,0,0,6,,"Page 1. Fig. 1 Frames of example video of expressive motion Quantification of Signal Carriers for Emotion Recognition from Body Movement and Facial Affects Daniel Roth1, 3, Carola Bloch1, Anne-Kathrin Wilbers2, Kai Kaspar2, Marc Erich Latoschik3, and Gary Bente1 1 …"
0,S Anasingaraju,Relative Importance of Different Body Channels to the Believability of a Stylized 3D Character Animation in a Full Body Shot,2017,,search.proquest.com,http://search.proquest.com/openview/30774b7716cda7c3a456ab416e579a64/1?pq-origsite=gscholar&cbl=18750&diss=y,,336,3/9/20 17:32,,,,,,,,,0,0,0,1,3,Character animation involves movement in different channels of the character's body. There is a norm in the animation industry that each of these different body channels has varying contributions to the believability of an acting performance: body movement being the highest …
0,AA Samadani,Automatic Recognition and Generation of Affective Movements,2014,,uwspace.uwaterloo.ca,https://uwspace.uwaterloo.ca/handle/10012/9000,,337,3/9/20 17:32,,,,,,,,,0,0,0,1,6,"Body movements are an important non-verbal communication medium through which affective states of the demonstrator can be discerned. For machines, the capability to recognize affective expressions of their users and generate appropriate actuated responses …"
0,"W LI, S HAN, S LIU, Y YANG, L ZHANG…",Scene effects on facial expression detection: The moderating effects of trait anxiety,2019,Acta Psychologica …,journal.psych.ac.cn,http://journal.psych.ac.cn/xlxb/EN/Y2019/V51/I8/869,,338,3/9/20 17:32,,,,,,,,,0,0,0,6,1,"Facial expressions are fundamental emotional stimuli. They convey important information in social interaction. Most previous studies focused on the processing of isolated facial expressions. However, in everyday life, faces always appear within complex scenes. The …"
0,"AC de C Williams, J Kappesser",Why Do We Care? Evolutionary Mechanisms in the Social Dimension of Pain,2018,Social and Interpersonal Dynamics in …,Springer,https://link.springer.com/chapter/10.1007/978-3-319-78340-6_1,,339,3/9/20 17:32,,,,,,,,,0,0,0,2,2,"Human expression of pain and others' responses to it are explored using an evolutionary framework. Pain itself functions to promote recovery, and both the capacity to react to damaging stimuli and many behaviors showing the aversive nature of the event are …"
0,H Joo,"Sensing, Measuring, and Modeling Social Signals in Nonverbal Communication",2019,,pdfs.semanticscholar.org,https://pdfs.semanticscholar.org/e074/3608a2f4068e96a1f99fe20b83dd1125d32b.pdf,,340,3/9/20 17:32,PDF,,,,,,,,0,0,0,1,1,"Humans convey their thoughts, emotions, and intentions through a concert of social displays: voice, facial expressions, hand gestures, and body posture, collectively referred to as social signals. Despite advances in machine perception, machines are unable to discern …"
0,"ASR Manstead, B Parkinson",Emotion theories.,2015,,psycnet.apa.org,https://psycnet.apa.org/record/2015-05078-005,,341,3/9/20 17:32,,,,,,,,,0,0,0,2,5,"Our goal in this chapter is to analyze some issues confronting theorists seeking to explain the phenomenon of emotion. We start by examining a potential obstacle, namely, the lack of a theory-independent way of defining emotion. The result is that theorists who favor …"
0,"MS Allen, SJ Knipler, AYC Chan",Happiness and counterfactual thinking at the 2016 Summer Olympic Games,2019,Journal of sports sciences,Taylor & Francis,https://www.tandfonline.com/doi/abs/10.1080/02640414.2019.1592803,,342,3/9/20 17:32,,,,,,,,,0,0,0,3,1,"The purpose of this study was to investigate potential differences in emotional expression and counterfactual thought between bronze and silver Olympic medallists. In Study 1, 468 photographs (156 gold medallists, 156 silver medallists, 156 bronze medallists) were …"
0,N Fourati,Classification and Characterization of Emotional Body Expression in Daily Actions,2015,,tel.archives-ouvertes.fr,https://tel.archives-ouvertes.fr/tel-01282785/,,343,3/9/20 17:32,,,,,,,,,0,0,0,1,5,"The work conducted in this thesis can be summarized into four main steps. Firstly, we proposed a multi-level body movement notation system that allows the description of expressive body movement across various body actions. Secondly, we collected a new …"
0,"JM Montiel, D Bartholomeu, GA Fiamenghi, FG Franco…",Do First Impressions Count? Perceived Nonverbal Behaviors Associated with Social Acceptance in University Students,2017,Psychology,scirp.org,https://www.scirp.org/html/9-6902178_77785.htm,,344,3/9/20 17:32,HTML,,,,,,,,0,0,0,5,3,"This study aims to analyze the relationship between non-verbal behavior of social interaction and acceptance and rejection in college, making sure that there are differences from beginning to end of the half as the acceptance and social rejection to study and do well …"
0,P Rajhans,A developmental perspective on the importance of context in emotion perception,2016,,archiv.ub.uni-heidelberg.de,https://archiv.ub.uni-heidelberg.de/volltextserver/21504/,,345,3/9/20 17:32,,,,,,,,,0,0,0,1,4,"Emotion perception is a context sensitive process Barrett et al.(2011). However, the developmental origins of the importance of context in emotion perception remained unspecified till date. The major goal of this dissertation was to extend Barrett et al's.(2011) …"
0,P Razavi,How Nonverbal Behaviour and Game Context Alter Athletes Perceptions: A Study of Nonverbal Influence on Expectancy of Success and Impression Formation in …,2018,,dr.library.brocku.ca,http://dr.library.brocku.ca/handle/10464/13848,,346,3/9/20 17:32,,,,,,,,,0,0,0,1,2,"Nonverbal behaviour is a social cognition component of sport psychology. The purpose of this study was to determine the impact of non-verbal behaviour (NVB), and game scenarios immediately after a mistake was made. Participants (N= 103) were randomly assigned to …"
0,AK Das,Emotion Recognition: Benefits and Challenges,,dasbin.com,,http://dasbin.com/research/emotion.pdf,,347,3/9/20 17:32,PDF,,,,,,,,0,0,0,1,,"CONTEXT This project is done as a coursework for the Affective Computing and Human-Robot Interaction. The project initially involved three MSc. ICT students. However, a student dropped out of the course in the middle. The project involved recording of various physiological and biomechanical …"
0,"RA Smith, FE Pollick, ES Cross","Developing a Framework for Emotion Recognition from Complex, Abstract Whole-Body Movements",,researchgate.net,,https://www.researchgate.net/profile/Rebecca_Smith41/publication/334398102_Developing_a_Framework_for_Emotion_Recognition_from_Complex_Abstract_Whole-Body_Movements/links/5d2744d192851cf4407a6baf/Developing-a-Framework-for-Emotion-Recognition-from-Complex-Abstract-Whole-Body-Movements.pdf,,348,3/9/20 17:32,PDF,,,,,,,,0,0,0,3,,"Procedure• Forced-choice emotion recognition task• Eye-movements were recorded during the task• Saccade and Fixation data captured using EyeLink Desktop-Mounted Software• Dynamic regions-of-interest were manually created (frame-by-frame) around the head, arms …"
0,JL Baumanis,The Comprehensive Conductor: A Supplemental Text to the Instrumental Conductor Curriculum,2019,,search.proquest.com,http://search.proquest.com/openview/7a6b97a2b1aa84117a84df2bfb40505f/1?pq-origsite=gscholar&cbl=18750&diss=y,,349,3/9/20 17:32,,,,,,,,,0,0,0,1,1,"Since the 1940s, conducting has been a mainstay in the undergraduate instrumental music education curriculum in the United States. One of the purposes of instrumental conducting courses is to prepare students for the occupation of band director after graduation. While …"
0,M Missana,Infant Processing of Emotional Faces and Bodies: Insights from Event-related Potentials and Asymmetrical Frontal Brain Activity,2015,,archiv.ub.uni-heidelberg.de,https://archiv.ub.uni-heidelberg.de/volltextserver/19768/,,350,3/9/20 17:32,,,,,,,,,0,0,0,1,5,This thesis investigated the electrophysiological bases of infant processing of others' emotional facial and body expressions using EEG/ERP and frontal EEG alpha asymmetry. Within the first year of life infants are already able to discriminate facial expressions of pain …
0,"SN Garfinkel, HD Critchley",BN1 9RR,,,,,,351,3/9/20 17:32,CITATION,,,,,,,,0,0,0,2,,
0,"G Orgs, B Calvo-Merino, ES Cross",Knowing dance or knowing how to dance?: Sources of expertise in aesthetic appreciation of human movement,2018,The Neurocognition of Dance,taylorfrancis.com,https://www.taylorfrancis.com/books/e/9781315726410/chapters/10.4324/9781315726410-13,,352,3/9/20 17:32,,,,,,,,,0,0,0,3,2,What makes and what moves dance? How is it possible for a choreographer and dance ensemble to join together in capturing and developing those sensations and images in movement and dance that will actually move an audience? How is it possible for a …
1,"T Mittal, U Bhattacharya, R Chandra, A Bera…","M3ER: Multiplicative Multimodal Emotion Recognition Using Facial, Textual, and Speech Cues",2019,arXiv preprint arXiv …,arxiv.org,https://arxiv.org/abs/1911.05659,"https://scholar.google.com/scholar?cites=14836909042818641191&as_sdt=2005&sciodt=0,5&hl=en",353,3/9/20 17:32,,,,,,,,,1,1,0,5,1,"We present M3ER, a learning-based method for emotion recognition from multiple input modalities. Our approach combines cues from multiple co-occurring modalities (such as face, text, and speech) and also is more robust than other methods to sensor noise in any of …"
0,"DN Albohn, D Vredenburg-Rudy, S Gallagher, K Rush…",Seeing Emotion in a Neutral Face: The Moderating Role of Social Stress on Facial Affect Recognition and Mimicry,2014,,cpb-us-e1.wpmucdn.com,https://cpb-us-e1.wpmucdn.com/sites.psu.edu/dist/5/25162/files/2015/04/Thesis-Poster-Draft-2.1.pdf,,354,3/9/20 17:32,PDF,,,,,,,,0,0,0,5,6,"Research from social neuroscience and social vision has shown that seemingly minute changes in facial characteristics (eg, sex, hair, head tilt, angularity, etc.) can change the perception of emotion. However, relatively little evidence examines how internal bodily …"
0,M Pearson,Multiple intelligences and therapeutic alliances: Counsellors' experiences of incorporating a multiple intelligence approach to counselling,2014,,researchonline.nd.edu.au,http://researchonline.nd.edu.au/cgi/viewcontent.cgi?article=1095&context=theses,,355,3/9/20 17:32,PDF,,,,,,,,0,0,0,1,6,"Counselling clients display many ways of reflecting and communicating within therapy. Gardner's theory of multiple intelligences (MI), while applied widely in the field of education, has only recently been applied to the field of counselling, and has the potential to support …"
0,"ZS Galit, F Dita, LW Rachel",The Traumatic Story as Expressed Through Body Narration,2019,Journal of Loss and Trauma,Taylor & Francis,https://www.tandfonline.com/doi/abs/10.1080/15325024.2018.1507470,,356,3/9/20 17:32,,,,,,,,,0,0,0,3,1,"Over the last decades, a growing body of research has deepened the understanding of the complexity of traumatic events and their consequences. While verbal expressions of traumatic experience have long been studied, studies of nonverbal responses are scarce …"
0,"JBL Smith, CH Chuan, E Chew",Boundaries and novelty: the correspondence between points of change and perceived boundaries,,jblsmith.github.io,,http://jblsmith.github.io/documents/smith2012-dmrn-boundaries_and_novelty-slides.pdf,,357,3/9/20 17:32,PDF,,,,,,,,0,0,0,3,,"Page 1. Boundaries and novelty: the correspondence between points of change and perceived boundaries Jordan BL Smith, Ching-Hua Chuan and Elaine Chew DMRN+7 18 December 2012 Page 2. Outline I. What the research is about and why it is very interesting II. How the data were …"
0,"H AVIEZER, R HASSIN",Inherently Ambiguous,2017,The Science of Facial Expression,books.google.com,https://books.google.com/books?hl=en&lr=&id=J_-oDgAAQBAJ&oi=fnd&pg=PT349&ots=zPuLMeUc9j&sig=Y8IoZjwunkHJ0pO7syChVxXuB6A,,358,3/9/20 17:32,,,,,,,,,0,0,0,2,3,"Perhaps the most central distinction in emotion experience is that between positive and negative valence (Bradley & Lang, 1994; Mehrabian & Russell, 1974; Osgood, 1952). We approach ice cream stands and avoid dirty toilets, savor kisses from a loved one and suffer …"
0,Y Wu,Emotion as information: inferring the unobserved causes of others' emotional expressions,2018,,dspace.mit.edu,https://dspace.mit.edu/handle/1721.1/120629,,359,3/9/20 17:32,,,,,,,,,0,0,0,1,2,"Research in the domain of cognitive science has tended to neglect emotions. In my thesis, I take several steps to fill this gap by looking at people's representation of emotions, and its connection to other representations typically studied in cognitive science. I argue that people …"
0,SM Wenzler,"Expression, Perception and Recognition of Intense Emotions in Healthy and Depressed Individuals",2017,,d-nb.info,https://d-nb.info/1133360777/34,,360,3/9/20 17:32,BOOK,,,,,,,,0,0,0,1,3,"ZUSAMMENFASSUNG Die Emotionsverarbeitung, also das Wahrnehmen, Erkennen und Regulieren von Emotionen, spielen eine wichtige Rolle für das psychische Wohlbefinden des Menschen. Die Fähigkeit die Gefühle anderer zu erkennen und einzuordnen ermöglicht …"
0,D MONTOYA,The Face as a Dynamical System: Embodiment in the Time of Machines,2015,Emotional Expression: The Brain and the Face,books.google.com,https://books.google.com/books?hl=en&lr=&id=lCrhCgAAQBAJ&oi=fnd&pg=PT48&ots=Xzk5f1v4Mk&sig=dnSdCdY4HQM_BS51VBDFERcB0r0,,361,3/9/20 17:32,,,,,,,,,0,0,0,1,5,"The dynamic hypothesis in Cognitive Science is not new (Van Gelder, 1998) but it's application to the study of emotion and, specifically to the facial expression of emotion, has not been undertaken. Following this hypothesis it is clear that the emotional face can be …"
0,DHJ Lee,Emotional Eyes: from Sensory Evolution to Social Exaptation,2015,,pdfs.semanticscholar.org,https://pdfs.semanticscholar.org/fe01/06c472611c26fffb1ff8be81fe2361d2fadc.pdf,,362,3/9/20 17:32,PDF,,,,,,,,0,0,0,1,5,"Abstract “The eyes are the windows to the soul.” Cicero's quote captures how readily we use the eyes of facial expressions to communicate our internal states. However, we do not yet know how this ability came about. Darwin theorized that our emotional expressions evolved …"
0,"A Leroy, S Spotorno, S Faure",Emotional scene processing in children and adolescents with attention deficit/hyperactivity disorder: a systematic review,2020,European Child & Adolescent Psychiatry,Springer,https://link.springer.com/article/10.1007/s00787-020-01480-0,,363,3/9/20 17:32,,,,,,,,,0,0,0,3,1,"Abstract “Impairments in emotional information processing are frequently reported in attention deficit hyperactivity disorder (ADHD) at a voluntary, explicit level (eg, emotion recognition) and at an involuntary, implicit level (eg, emotional interference). Most of …"
0,E Diminich,Is this the face of sadness? Facial expression recognition and context,2015,,academiccommons.columbia.edu,https://academiccommons.columbia.edu/doi/10.7916/D8W66KGR,,364,3/9/20 17:32,,,,,,,,,0,0,0,1,5,"A long standing debate in psychological science is whether the face signals specific emotions. Basic emotion theol3, presupposes that there are coordinated facial musculature movements that individuals can identify as relating to a core set of basic emotions. In …"
0,RL Jubran,Body Processing and Attentional Patterns in Infancy,2019,,uknowledge.uky.edu,https://uknowledge.uky.edu/psychology_etds/162/,,365,3/9/20 17:32,,,,,,,,,0,0,0,1,1,"Bodies provide important social information, and adults benefit from this information by recognizing and responding appropriately to bodies. Body recognition is enabled by the fact that human bodies are defined by parts, such as the limbs, torso, and head, arranged in a …"
0,VK Manduva,Simple cephalo-caudal patterns embedded in complex human interpersonal behavior,2014,,europepmc.org,https://europepmc.org/abstract/ppr/ppr96872,,366,3/9/20 17:32,,,,,,,,,0,0,0,1,6,"A novel model is presented to explain human social behavior. In recent years, a cephalo-caudal directionality to behavior has been reported in a few mammals including rodents, cattle and cats. This model shows how complex human behavior also follows this rule of …"
0,JI Kajopoulos,Social cognition and robotics,2019,,edoc.ub.uni-muenchen.de,https://edoc.ub.uni-muenchen.de/25034/,,367,3/9/20 17:32,,,,,,,,,0,0,0,1,1,"In our social world we continuously display nonverbal behavior during interaction. Particularly, when meeting for the first time we use these implicit signals to form judgments about each other, which is a cornerstone of cooperation and societal cohesion. The aim of …"
0,VK Manduva,Simple cephalo-caudal patterns embedded in complex human interpersonal behavior,2013,,PeerJ PrePrints,,,368,3/9/20 17:32,CITATION,,,,,,,,0,0,0,1,7,
0,"C Bartneck, T Belpaeme, F Eyssel, T Kanda, M Keijsers…",Human–Robot Interaction,,pdfs.semanticscholar.org,,https://pdfs.semanticscholar.org/3b00/6b1670c74268e30cbe87a96daa9af7b41db2.pdf,,369,3/9/20 17:32,PDF,,,,,,,,0,0,0,6,,"There'sa lot of talk about robots these days. Robots are in the news, on the movie screen, and even in our daily lives. Have you ever interacted with a robot? A vacuum-cleaning robot? A robotic toy, pet, or companion? Chances are that if you haven't, you will soon …"
0,"P del Monte-Luna, SAG del Próo…",Is experience the only way to improve public speaking in science?,2015,Nova …,novascientia.delasalle.edu.mx,http://novascientia.delasalle.edu.mx/ojs/index.php/Nova/article/view/75,,370,3/9/20 17:32,HTML,,,,,,,,0,0,0,3,5,"Introduction: Any science practitioner is constantly exposed to public speaking (PS) situations: conferences, congresses, symposia, workshops, etc.; thus it is essential to communicate our ideas in a clear and convincing manner during an oral presentation …"
0,"JR Hodges, O Piguet",Beyond the face: how context modulates emotion processing in frontotemporal dementia subtypes,2018,,researchgate.net,https://www.researchgate.net/profile/Fiona_Kumfor/publication/322917612_Beyond_the_face_How_context_modulates_emotion_processing_in_frontotemporal_dementia_subtypes/links/5a7782dfa6fdccbb3c098916/Beyond-the-face-How-context-modulates-emotion-processing-in-frontotemporal-dementia-subtypes.pdf,,371,3/9/20 17:32,PDF,,,,,,,,0,0,0,2,2,"Social cognition is increasingly recognized to play an important role in determining current and future functional capacity and independence of dementia patients, and their associated carer burden. Social cognition is a dynamic, multi-componential process that requires the …"
0,S Wang,Social Saliency: Visual Psychophysics and Single-Neuron Recordings in Humans,2014,,thesis.library.caltech.edu,https://thesis.library.caltech.edu/8230/,,372,3/9/20 17:32,,,,,,,,,0,0,0,1,6,My thesis studies how people pay attention to other people and the environment. How does the brain figure out what is important and what are the neural mechanisms underlying attention? What is special about salient social cues compared to salient non-social cues? In …
0,"O Korn, A Rees",Affective effects of gamification: using biosignals to measure the effects on working and learning users,2019,Proceedings of the 12th ACM International Conference …,dl.acm.org,https://dl.acm.org/doi/abs/10.1145/3316782.3316783,,373,3/9/20 17:32,,,,,,,,,0,0,0,2,1,"What emotional effects does gamification have on users who work or learn with repetitive tasks? In this work, we use biosignals to analyze these affective effects of gamification. After a brief discussion of related work, we describe the implementation of an assistive system …"
0,K Osborne-Crowley,Social Cognition in the Real World: Reconnecting the Study of Social Cognition With Social Reality,2020,Review of General Psychology,journals.sagepub.com,https://journals.sagepub.com/doi/abs/10.1177/1089268020906483,,374,3/9/20 17:32,,,,,,,,,0,0,0,1,1,"The scientific study of social cognition is a growing field which promises to deliver valuable insights into how the brain underpins human's social success. However, the poor ecological validity of many popular paradigms constrains the progress of social cognitive scientists …"
0,"CM DOYLE, KA LINDQUIST",Language and Emotion,2017,The Science of Facial Expression,books.google.com,https://books.google.com/books?hl=en&lr=&id=Vu50DgAAQBAJ&oi=fnd&pg=PA415&ots=bMai-kX31S&sig=3DW4lCn342OCs8nf85ut8EcgdZY,,375,3/9/20 17:32,,,,,,,,,0,0,0,2,3,"Throughout much of daily life, humans detect emotional “expressions” in the faces of our loved ones, friends, colleagues, babies, pets—even in certain machines (see Fig. 22.1). Traditionally, the science of emotion assumed that these “expressions” are broadcast on the …"
0,"S Lammers, G Bente, R Tepest, D Roth…",Introducing ACASS: an Annotated Character Animation Stimulus Set for controlled (e) motion perception studies,2019,Frontiers in Robotics …,frontiersin.org,https://www.frontiersin.org/articles/10.3389/frobt.2019.00094/abstract,,376,3/9/20 17:32,,,,,,,,,0,0,0,5,1,Others' movements inform us about their current activities as well as their intentions and emotions. Research on the distinct mechanisms underlying action recognition and emotion inferences has been limited due to a lack of suitable comparative stimulus material …
